overall,reviewText
1.0,"I bought 2 of those SanDisk 32 GB microSD , used them on my Galaxy Note and Galaxy S4First one , my phone started saying it was removed , then recognize it again :) then diedI thought it's just a luck , plugged in the 2nd one :) stayed for about 2 months and died suddenly ! and lost everythingnever buying from SanDisk again .. ever"
1.0,"I bougth this micro SD card after some trubles with other that i got from Kingston, i can tell that SanDisk is other quality, this is the best, my i9300 phone can read a 64GB very fast, the dta transfer speed from my pc to my is amazing, if you are looking for additional storage to you phone, for music, pictures and other type of files, this is for you.Pros-Very good quality materials of construction-Amazing speedUpdate after one year this memory is damaged I can not delete or put new files on it, I can not format this memory, I tried to format with my phone, with my pc, with a camera and nothing, now this is like a 64gb cd, the data in the memory is only available to read but I can not move, or delete it, I bought this memory to be used to backup all my data of my android device but now is only a readable memory I can not write data on it any more, I hope sandisk make a better products in the future!!! Total disagree I will buy a Samsung memory card expected a better quality."
1.0,"Ordered this for a Galaxy S3.  Lasted a few months and then broke.  Is not accessible on several different PC's.Says ""limited lifetime"" warranty - BS.  You have ONE MONTH for Eco Zone.  Not only did I lose pictures but now I am out $$ because of a crappy return policy.In the future I will be buying Kingston, not Sandisk.-----------------Update:  Amazon Customer service made good and refunded my purchase price.  I still will not be buying any more Sandisk memory cards however..."
1.0,"I have an old SanDisk SD card that still works. I thought their new cards would be just as reliable, but I was wrong.The microsd card failed yesterday inside my phone. I used the adapter to connect it to my computer, but it wouldn't mount.I bought this directly from Amazon and not a third party vendor, so I know it's genuine SanDisk."
1.0,"I bought this on August of 2013.  As of April 2014 the card stopped functioning.  It can still be read, but the writing capability is gone.  That's less than one year.  I'm extremely disappointed in the longevity of this card.  My usage of it has been on my Galaxy S4.  I have about 40Gb of data in it.  Guess I'm going to have to look for another card that has a longer lifespan than this one."
1.0,"I routinely use SDXC cards up to 128GB, and this card was unreadable on arrival.  Both of my PCs said it needed to be formatted, and as a last resort I let one of them try (Windows 7/i7with up-to-date SDXC drivers), and it could not format it.  It's on its way back to Amazon.  I'm glad their returns are so easy!"
1.0,"Had to return this item, it would not fit properly into the adapter that it came with.  Return was no problem, but I am reluctant to buy another one."
1.0,"Having used SanDisk before in my photography, I of course went to them when it was time to outfit my new Samsung Galaxy S3 with an internal microSD card. I spent the extra bucks over comparably ""no name"" Micro SD cards and bought this variant. I took quite a few pictures and even transferred an album from my computer so I coud show it to friends on the go.After less than two months, the SanDisk microSD card started acting up. It was not recognized, stopped, restarted, removed itself, reinstalled itself onto the phone - erratic behavior. Here is where I should have taken it out immediately and tried to recover anything I could before things hit the fan...unfortunately I waited too long and this morning, for no other reason than I turned my phone on, the card shows up as blank. Neither my Windows PC, nor my Mac, can even detect the card and yes, i tried two different adapters, and I tried the SanDisk recovery which ""found no recoverable files"" even though I checked all file type extensions.I've apparently lost all the pictures I had on there. To top it all off, my GF's cheap ""no name"" card has never had an issue in her exact same phone and keeps chugging along merrily.Paying a premium for a substandard product that fails in use after two months? No thanks. I'm going back to Lexar, which hasn't failed me yet. I'm also getting rid of all my SanDisk cards for my DSLR's, just in case. The fact that SanDisk is the first card thats ever failed on me, and a new card to boot, does not inspire confidence. Buy and use at your own risk."
1.0,"I am very disappointed in this card.  I usually don't have an issue with SanDisk, but this 32GB ultra card died after two months.  Died as in, no longer recognizable by PC / Camera or any device.  Now I have to wrestle with warranty claim."
1.0,"I bought this card for my android based phone, soon I started getting messages that my card had been removed and or it was damaged, Tried it in my tablet same thing, and this was not the first card of this brand that I had bought that experienced this problem. Went to several online forums to see what the solution is; then someone hit upon it, it just might be a problem with this brand of cards.I bought a PNY brand micro SD card and had no problem whatsoever."
1.0,"I bought this card on the strength of the 64GB XDSC SanDisk in my phone right now.  It was a gift for a friend of mine and sadly it corrupted within minutes of first use.Initially it worked fine, then dead.  We checked in a laptop and Windows Disk Management screen told me it had a single 128K partition and the rest was unusable.  Outstanding.The replacement sent by Amazon (Thank you Amazon, you are always excellent) is sitting in my office right now, I should probably check it out."
1.0,Worked fine in my Samsung S4 for one year.  Then it stopped allowing writing to the card.  Would not format even on a PC or with another device.  The data is still there but cannot be erased.
1.0,"My card got so hot it almost melted. Crazy! But you card somewhere else, I know I Wii! I'm not taking the chance of ruining one of my devices. No thanks"
1.0,"Received one - didn't work. Not readable on my Mac or my Win 7 PC. Tried another - retail packaging and is raw format and although my Galaxy S3 sees it, it won't write or format and the computers don't pick it up either.Taking the other person's 1 star review and trying a class 6. Can't afford to lose data, not that I can write to these anyway. Both went back."
1.0,"If your card gets hot enough to be painful, it is defective and you need to contact SanDisk!From my experience, the larger micro SDs run hot on format and writing, but not to the pain threshold!I purchased one of these cards to use in a camera and Android tablet.  Great read speed but write speed was okay.  Used card for about two weeks and then all my files disappeared!  Tried to format the card and three different computers with XP, Windows, and Linux couldn't format it.  The camera and tablet couldn't format it.  I RMA'd it and got another because SanDisk is a good brand.  I did notice that when formatting or writing the card it got hot, very hot.Second card didn't last 24 hours and had the exact same symptoms as the first card.  Write a file or format it resulted in the card getting hot enough to reach the pain threshold.  I called up SanDisk and while explaining this was the second card I'd received with the exact same symptoms, when I mentioned it getting hot, they immediately issued me an RMA.  They said they were told to issue an RMA the moment they heard a card ran hot.Smaller SanDisk micro SD's or regular SD's I have or use don't do this.  I think SanDisk has an issue with this card.The last 4 digits of the part number refer to the date code and origin of the card.  Both cards had different date and origin codes."
1.0,"Does not work.  I have a card purchased at Best Buy that looks identical side by side.  BUT!  Transferring music onto the Best Buy purchased card was extremely fast.  100+ meg albums transferred in 2 to 3 seconds.  On these cards, a 61 meg album was at 18 minutes remaining with less than a quarter of the album transferred.  I bought two, so I figured maybe a bad card.  Tried the other, same thing.  Extremely slow.  Wonder if they are even real."
1.0,"Card is Good. I ordered one before and it performs as one would expect, so I ordered another. It took much longer to attempt get the second one so I wrote and got a refund. Seller, NMicro Technology,  was not the same as the first."
1.0,"the unit shows 0 bytes, in a PC or the phone. it keeps dismounting also. I got a replacement and it did the same thing. Not sure what is going on but it looks like a Chinese counterfeit case. I have seen this happen more and more lately. Amazon seems to be a major portal for these hings, it makes sense with a such a large retailer, they cant check everything."
1.0,"had it in my samsung tablet and it went bad after 2 months, wont let me reformat or read it or do anything with it. money down the drain."
1.0,"I got the micro sdcard 64gig, I reformated to fat32 and works very well on my galaxy s2 i9100 with no problems at all, thanks:DEDIT: After 7 months of using this memory card, now i tried to format it but it wouldn't, i tried about 5 different methods and none of them worked, i wouldn't recommend buying this one: SanDisk Ultra 64GB MicroSDXC Class 10 UHS Memory Card Speed Up To 30MB/s With Adapter, Frustration-Free Packaging - SDSDQU-064G-AFFP-A. Avoid buying it or you will experience problems in half a year."
1.0,"I purhased this thinking I was getting an amazing deal.  The price was right, the product was not.  After a few months I am unable to delete or add files, pics or music to this microsd card.  I am only using 28gb of space on it.  I cannot add anything, nor delete anything, it won't even allow me to format it and start fresh.  I am not happy with this product and extremely disappointed.  I use my phone a lot and store music and pictures on my phone for various purposes.  I would recommend buying another 64gb microsd card.  One that is more reliable."
1.0,"Ordered this from Amazon and was expecting it to work perfectly like my other 32GB sandisk (in my galaxy s4). However, I was really disappointed that upon placing it in my note 10.1 2014 edition the card become unrecognizable. I tried reformatting on the computer, on the phone, and yet, no prevail. It could be the firmware or current update of android, but the point is that, if other companies can make a card that works, why not do the same? Maybe I got a bad batch, who knows...I went ahead and ordered the G.Skill microsd card and now it's working perfectly. I'm s"
1.0,"I really want to like these and I do trust SanDisk more than other manufacturers of memory cards. That said, I'm moving on to my 3rd card. Thank you Amazon for having exceptional customer service, or else I'd be very upset.Basically this card will suddenly not allow writing to it anymore. You can't save files to it, you can't delete files from it and you can't event format it. I've tried doing all three in different OS'es and devices with no luck. Doing some reading on the SanDisk forums this seems to be happening a lot with these cards.I'm returning this to Amazon and trying my luck with a different brand to see what happens."
1.0,"randomly erases all my data and asks me to format card on my unmodified unrooted sprint Galaxy SIII ,i dont know how scandisk is selling these,i trusted the brand and it didnt work"
1.0,"I had this for my smart phone and it kept dismounting itself.  I did some research and found out that there are others experiencing the same problem.  So, I returned this and got Transcend instead.  Transcend works fine with no problem."
1.0,"This card was used in a phone without a large amount of write stress (which does shorten the life of the card - it was not written to over and over in the phone).The card is now totally unwriteable - on a Mac, a Linux machine, or the phone - writes all ""seem"" to succeed but even low-level reformats don't actually *do* anything - the exact same files are there after every change, untouchable and frozen forever.10 months of use out of a memory card and then a really weird failure like this (neither the Mac, Linux machine, or phone reports any error) is not acceptable quality from SanDisk."
1.0,"I have had this for 8 months, and the SD Card already stopped deleting files and keeping pictures.  I have tried reformatting, and nothing helps.  Not cool.Update - April 2, 2014 - I contacted Sandisk and I am sending the problematic card back for warranty replacement.  I hope this will resolve the issue with the card.  I will keep you updated once the process is complete."
1.0,This card failed after 2 weeks of use.  I have the same problem with their SSD failed on me after 6 months.
1.0,"Ive had the card for over a month, using it in my Samsung Galaxy Note 10.1.I filled the card with a few TV shows and movies to watch on the go, as well as many PDFs and MS Word Docs.The MS Word and PDF files often get corrupted after use. THe larger files seem to stay intact. I moved the smaller files into the internal storage and havent had problem since.Im hoping Sandisk has a decent return policy."
1.0,"No way to format it. I even downloaded 2 programs that claimed were able to format it, After wasting about 6 hours, I decided to give up and send it back, The seller should format them before sending them, even if they would charge $5. extra, it would be well worth it instead of the hassle of downloading programs and wasting time trying and sending it back after hours of frustration."
1.0,I was better off with my 32gig card.  This thing was nothing but problems.  The phone does not see it half the time and it is SLOW.  The phone keeps asking to Re- format it.  I got it to see the card after a reboot.  It is still SLOW.I will be buying the Samsung 64gig card for my Samsung Galaxy Note 1.  I have seen good things from Samsung.
1.0,"Bought 2 of these for the wife's & my Android phone. When her's failed after 2 months, we figured it was just luck of the draw. Now mine failed after just over 4 months, losing a bunch of photos & videos (I made sure to back up every few weeks but even so, we just lost a bunch of photos of our 2 month newborn).Clearly SanDisk had a bad batch with this lot and as the return policy is horrible, I won't be buying any more SanDisk, no matter how cheap (when we bought them on sale around January 2013 they were over half the price of similar SD cards; again, SanDisk clearly knew they had a bad batch, shame on them for dumping them on the customer, no matter how cheap).While I would presumed they would have solved the problem in production, buy at your own risk, SanDisk will sell product with ridiculous failure rate.EDIT: After submitting my review I did some more research on other sites and the low star reviews here. SanDisk is so clearly guilty of selling a defective product from the batch about 6 months ago. Which as I said before, is when they put them on a super discount sale. They knew what they were doing and they are thumbing their nose at customers who just fell outside warrantee (like myself).To knowingly sell your customer something that is going to fail at an unacceptable rate and then ignore them because it failed a little bit outside warrantee is just bad faith. I beg people considering buying this product to not do so, and thumb up the reviews warning of failures. It is only when companies lose sales do they reconsider not screwing their customers like this.Personally I have bought several SanDisk thumb drives, CompactFlash cards, and a Sandisk MP3 player. The thumb drives were ok but I wouldn't buy another mp3 player from them (it was buggy as hell). Up until now I had an overall neutral to favorable opinion of them, not anymore.If you think I am overreacting, please just skim through a few pages submitted in springtime of 2013. There is at least one or more ""6 months and it failed"" reviews per page."
1.0,"Losing pictures, video, and tunes after 9 months on a Samsung Galaxy Note 2 (stock android).  Looks like this is a common problem.  I will try my luck with Sandisk on Monday.  If I don't get a replacement, I will never buy a Sandisk product again.  I paid the premium for ""Sandisk Quality.""  I am very disappointed.UPDATE:Sandisk will be providing a replacement SD CARD.  However, my data loss and downtime cannot be replaced.  SanDisk lost their ""premium rating"" in my eyes. It's going to take a while for them to get it back."
1.0,Used for two months in Samsung Galaxy.  Fizzled then failed.  I have never experienced a memory card or or flash drive failure until this SanDisk Ultra 32 GB.  Will purchase a different brand next time.  Return for refund or replacement is not allowed.
1.0,"Bought October 7th. Passed away December 23rd. RIP.I didn't really even use it because of the built in storage on my GS3. I had about 15 gb of music and movies on it, but only for when I was unexpectedly bored and without my zuneHd. On to the next brand I guess."
1.0,"This does not appear to work with the Samsung Galaxy S3.  It worked for a few weeks, then my phone started giving me ""Unexpected Unmounted SD Card"" error messages.  After a bit of searching, people seem to agree that the S3 and Sandisk micro SD cards do not work together."
1.0,"I purchased a 64Gb Samsung SD card to expand the memory of the phone.However, I frequently get a message that the card has been removed or is recovering.Sometimes the problem clears itself, other times I have to reboot the phone.It also says ""MTP application will restart to prepare SD Card"". It then starts listing the restarting/recovering SD card.I eventually replaced it with a Sandisk 16gb microsd ""HD"" card from Walmart and it is operating fine.I have been reading a lot about people having issues with the 64gb sandisk cards and the Galaxy S4.I wish I had done more research before wasting $50 on what I thought was a good buy!"
1.0,"I put this in my Galaxy Note II and put a bunch of music and PDFs on it.  I also used it to save videos and photos.  It worked well for about 2 months then, on Christmas Day (today), it said that there was an error reading the card and the card was now blank.  My phone no longer recognizes the card and even putting it into its adapter and sticking it in the SDHC reader of my laptop doesn't work.If this is SanDisk Quality, then I am not impressed.  I am going to have to deal with their warranty replacement but I'd rather have a refund than get another card that might fail after 2 months..."
1.0,"Do not buy, card failed on the third usage.  Kicker not to my favoris you only have about 2 months to return this card for a full refund.Then, it's a pro rated rated deal when you send it back to Amamzon inLexington, KY.The failed card was in a GoPro White Edition. Needless to say, a camera thatwas purchased for summer outdoor usage in November is going to sit for quite awhile before you have time to get your money back.  Card sat all winter and failedtowards the end of April.  6 months lag to get a decent, even pro rated refund.Out of all the items I bought from Amazon this is my only bad experience.64 gigs crammed on a tiny micro SD card is too much.  I'll stick with thesmaller 32 gigs until this technology is meant to last.Refund Update, once again Amazon did the right thing anbd refunded full purchase pricefor the dead 64 gig.  Amazon is where I shop for 2 reasons.  1. I live 50 miles frombig box stores and 2. they ALWAYS make things right with no muss ...no fuss.I replaced the dead card with Amazon brand Micro 32 gig SD micro card.I have purchased Amazon branded SD cards before and they work just as good as any.Not to mention the cost savings."
1.0,"I get randomly error messages with my nokia808, ""disk error-"" and the card stops working, its so, so sad.. I bought a cheap 8gb micro sd class 4 that works better than this :("
1.0,"I wish I could say this card was great. Been waiting for it for around a year and a half whilst using the 64GB one (also SanDisk) which never gave me issues; sadly I lost it. This card confused the heck out of me. I used it on my S4 and first off, it wouldn't recognize it. Tried it on my gf's S4 and same problem.Apparently it comes formatted as exFAT and thought maybe reformatting it as FAT32 would solve the problem. Well I thought it did since my phone finally recognized it upon inserting it. A new problem arose, though. I started taking pictures to try it out and odd thing was some of the pictures became corrupted. Not even viewable on the phone seconds after taking them. Some worked, others not.Later on, I restarted my phone for some reason or other. A while later I wanted to check the pictures again and, surprise surprise, everything was gone. I'd find out later that every time I restarted my phone everything on the card was being deleted. Tried it on my gf's phone and same thing happened.Tried reformatting again as FAT32 using GParted (couldn't hurt) and it just throws errors upon starting the write sequence.Too bad I can't return it as I had it shipped to me in Guatemala. So that's $119 down the toilet. I have to buy a new one now, but I think I'll go for the new Samsung EVO ones (although they don't offer a 128GB model as of this writing - bummer)."
1.0,"I ran several tests both on my computer, and my phone it wrote at 6MB and read at about 6 to 10 depeneding on its mood. I bought this to replace a generic 32GB class 10 card that I lost (so dang small i droped it and could not find it. that Card actual wrote at 11 to 12MB and read at 20MB. I went with sandisk because my phone came with a class 2 that performs more like a class 6. What a waste of time. Refunded this item"
1.0,"Yeah. Ultra Hot. I could not get any of my devices to recognize this card. When I finally was, using a USD reader, I tried to format it. It wouldn't format and burned my fingers when I removed it. Others have also posted this. Maybe they are not all bad, but many are. Perhaps they are counterfeit, I don't know. But the hassle of having to return it isn't worth the $10 you may save."
1.0,"I've only had this Memory card for 3.5 weeks and it not only has recently started resetting, it intermittently loses contact with my Cell phone and the memory is lost, erasing everything on it!!!!!! Now I find out my return date has past and I'm stuck with a peice of s*** memory card that I can't do a damn thing about! Thanks a lot for nothing! I will never buy direct from here again!Also, I didn't realize I was supposed to have an adapter too? wow where the heck is that at???"
1.0,"This card does not work on droid razr phones. Whenever I try to transfer files on the card, it makes the phone freeze completely. I have tried every possibility to get this to work, but this type of card is worthless because it does not work due to its high capacity on phones. Every workaround I have tried to get this card to work, it still causes my phone to freeze."
1.0,"This card worked in my Galaxy S3 right off the bat.  I did not need to format it or anything.  After about 2 weeks, I was watching a video on my phone and it locked up.  Then the phone showed that the card was damaged.  Now I am unable to copy anything over 100mb to or from the card.  Viewing photos from the gallery also locks up the phone.  Amazon customer service is great, however.  They sent me a new card.  I will update my review after I am able to use the new one for at least a month without any errors.****UPDATE****After having the second card for a few weeks, it also had the same issues.  Even worse, the card was completely unreadable after it locked up.  The card showed about 5 GB of data being used, but could not be accessed via the phone or in a computer.  Sent this one back and will be going back to my trusty 16GB card."
1.0,"NOT GOOD REPEATEDLY SELF EJECTS FROM NEW GALAXY S4  RETURNED FOR EXCHANGE OR REFUND....BOUGHT TWO ONE WORKS WELL BUT ONE DOESN'T I GUESS IS DEFECTIVE....I HAVE TWO GAL S4,..IS WHY I BOUGHT 2..."
1.0,"I bought this to be able to load more music into my Verizon LG Android phone. I spent hours adding music to the card. Then, I put it into my Android phone. The phone did not read anything on the memory card. The other memory cards, 8GB and 32GB worked fine, so it must be a flaw in this memory card. Also, this memory card got stuck in my Android phone's slot. I had to use a utility knife with a very, very thin blade to pull out this card."
1.0,"There's a lot of counterfeits on these, and I apparently picked up a bum card from MemoryWhiz. My device shows me there's a 32gb of space there; it just is impossible to gain access to it. Rather, the /sdcard folder is found on my device's internal memory (the memory that came with the device). I even downloaded some apps that were supposed to read and write from my SDCard, but they work even when I unmount the card and remove it. So check out these cards thoroughly when you buy them and make sure they're what they say they are. Naturally, SanDisk isn't going to stand by a counterfeit."
1.0,"I would not recommend this card if your looking for REAL class 10 write speeds. The most I could get is 9mb/s from this card but for the most part it was about 7-8mb/s. I even did a slow format to exfat in windows 7 with no improvements. I copied over music, pics and movies to test it out ranging from a couple of mb to over a gb. The read speeds were pretty good at around 21mb/s though. I popped in a 32gb class 10 transcend SD card and it consistently got 16-18mb/s write speeds and 24mb/s read speeds. So in conclusion I think this card is not really a class 10. Too bad I read all the negative 1 star reviews after the fact but I will be sending this one back."
