overall,reviewText
1.0,"Fortunately I got this as a lightning deal, so it wasn't that expensive.  I purchased it in October, but didn't start using it on my Samsung Galaxy S3 until January.  It was fine, until it wasn't.  It chose to die today.  Just a little more than four months after I started using it.  I checked my phone this morning and it told me that the SD card had been unmounted.  I did not think much of it.  But when I rebooted my phone and was still unable to find the card, I began to be concerned.  When I got home from work, I put a different card in, and it worked fine.  I tried to check the card on my computer, and it couldn't be seen.  So the problem is definitely a card.  Unfortunately, I lost most of the pictures I've taken since getting this phone.  I know that I probably should have backed them up, but I really didn't expect the card to fail so quickly.  Perhaps if I'd read all of the one start posts before buying, I would have.  Oh well, back to my 16GB Amazon Class 10 card until I can get a different one.I'm not even going to bother with a warranty claim.  I don't need another card that will fail after four months."
1.0,"Got the SDSDQU-064G-AFFP-A on December 28, 2012, died on May 20, 2013Could not write to it or change any data, no matter what device i used. Even after format (Full & Quick using disk manager & EaseUS Partition Master 9.1.1 Home Edition, connected in a device or adaptor or usb adaptor) when disconnected and reconnected no change. Dropbox saved my data luckily (Had it syncing using Dropsync Pro).Was using it with Samsung Galaxy Note 2 T889 for the whole time, never was removed."
1.0,"I haven't figured out yet if I'm a dummy or if I have a defective card.  I don't know if the card is bad since I can't even get the card to stay in my Samsung Galaxy S4.8.  The little card will go in (the larger one won't) but it won't stay in.  If I put pressure on it the Samsung says .. preparing SD card but as soon as I release pressure the Samsung says .... card removed.This card came from a source outside of Amazon and took way to long to get here.  It arrived in a white envelope with NO instructions.  I'm very upset about this purchase as I've never had a problem before with either SanDisk or Amazon.  I'll try to find someone with more experience than me to give this a try before I return it.  I would have expected this to come in a package from SanDisk, like other SanDisk products I've bought in big box stores or from Amazon but it did not."
1.0,06.NOV.2012 - Bought the card.12.JAN.2014 - Card failed.It cannot be formatted or used in any way.It lasted 14 months and most of that time I was not even using it.
1.0,"NOTE:  please read the last update (scroll to the bottom) - I'm leaving this review as 1 star as it appears to help others who purchased and had a similar experience.I give SanDisk 5 stars for customer service and 1 star for the product (for those manufactured in the past)  For those newly manufactured products that contain the software ROM fix, I'd give the product 5 stars.To all those who purchased this card due to all the great reviews.... and then used it in a Galaxy S4 (GS4) smartphone for storage, the solution to the problem is not one you can solve without returning the card to SanDisk for a replacement under warranty.  Believe me I tried everything that the Google searches returned as solutions... formatting as exFAT, formatting in the GS4 then copying data to the card while in the phone etc.... nothing worked... and so now please stop pulling out your hair and hopefully you will get the same result which I hope to get soon (just RMA'd and will send it back tomorrow for a free replacement under warranty).The problem (As confirmed from the SanDisk customer support rep when I asked specifically asked him):- When used in the GS4, this card will unmount itself inadvertently (may be true only for cards manufactured before the ROM patch described below was implemented in manufacturing).  This can cause the data to become corrupt (luckily was not my experience) and / or can be very frustrating as most of us are saving 13 MP camera pictures to the card (or MP4 movies that stop in the middle of the movie) and it unmounts when you view the picture in the gallery or worse, right when you take the picture (this was the issue I experienced).- SanDisk knows about this issue.  Again, SANDISK KNOWS ABOUT THE ISSUE AND WILL REPLACE YOUR CARD. Call them (info below) and they WILL take care of it under warranty.  They have a good name for a reason and they want to keep it. (sorry SanDisk about the 1 star, but I thought it was the way to get the message out to those searching for a solution)- The customer rep told me that SanDisk tried to work with Samsung to resolve the issue but Samsung refused to acknowledge a problem exists with this card and some of their phones (especially their flagship GS4 phones).- The customer rep told me that to their knowledge the card works fine in regular cameras (not Samsung GS4 phones with cameras, obviously) and even worked fine in some phones from HTC etc. that could accommodate the 64 GB cards. Hence the 5 star ratings from others.- The solution SanDisk came up with was to write a patch into the ROM of the card itself to specifically address the issue on Samsung GS4 phones (and maybe other Samsung phones like the GS3).  I was assured that the new card I would get would work flawlessly. will see in about 3 weeks.- I purchased my card from Amazon June 2013, so the ones currently being manufactured and the one I should get will have the new patch.  However, as SanDisk manufactures in batches (like most of the industry), old batches of ""unpatched"" cards obviously exist in warehouses.- I asked about a software patch I could download and was told it's not possible... hence the ""hard coded patch"" in the card's ROMSo... how to take care of the problem....After speaking with the SanDisk US customer support (link and info below), this is what I learned and did.Go to the SanDisk site1) [...]2) call consumer products support (this is the US no.) 1-866-SANDISK (726-3475)3) Tell them that the card is unmounting itself in your GS4 (I assume this is also a problem experienced by GS3 owners too)4) They will then confirm your information, approve your return (10-15 min approval window by mine was basically instantaneously), and then send you emails with a UPS return label and instructions.5) BTW, they also asked if I had a magnifying glass to ID the serial no. on the card, but I didn't and couldn't read it myself (those numbers are super small printed into the plastic... don't believe me?  take a look yourself.)  I told the rep I couldn't read them and he said no problem, they would process without the serial no.  I assume this is because they send you a new replacement card only when they receive your card you send in.  Makes sense.Well, that's it.  Problem (hopefully) solved.  Let's see in 2-3 weeks.  The rep was super nice about it and seemed like they were all too familiar with the problem.  KUDOS TO SANDISK FOR TAKING CARE OF IT... however, it would be nice if there was some type of communication / notice of the issue besides Google info sources, forums etc.  I spent hours, maybe a couple of days total hours worth, thinking it was an issue with my phone / my data transfer.  oh well, that's how it goes.I really hope that this review helps some of you out there with the same problem as me.  GOOD LUCK!!(btw, I'd give the card 5 stars if this problem was solved in the patched ROM of newer cards as the data transfer speeds are awesome on the card (tested transferring data via a card reader hooked to my computer)... if the data transfer / remaining mounted in the GS4 issue never existed (pre-patch of ROM, of course))UPDATE: 08/17/2013 - All went well with the return of the SanDisk Storage card.  UPS shipping took about 2 days from when I sent it, SanDisk verified the warranty claim 1 day later and 5 hours later that same day, my replacement card had been shipped. waiting on the new card now, but expect to test it out very soon (early next week).  will update the post after testing out the new card.  Just as a reference, I've been using a 32GB Micro SD HC SanDisk card in the GS4 since having shipped the 64GB card.  Obviously it's a different card and not the Micro SD XC kind. Other than a bit slower access speeds to the card, absolutely zero problems.... well if you don't count that it's basically filled up, hence why the 64GB option is great on the GS4. So it proves the point on the problem with the early build Micro SD XC 64GB cards.I'm happy to see that my review has helped some others out there.  Good luck to you in your warranty claim. my experience with SanDisk customer support has been excellent so far.Update: 08/21/2013 - Received the new replacement SanDisk Storage card just a few days ago (shipping back to me once they agreed it was defective was a very short time window).  Have had it running in the Galaxy S4 for a few days now without any jumps, stutters or card unloading in the middle of picture or video taking.  Card seems to work flawlessly as the SanDisk Rep mentioned it would. One would think it's such a short time to test after a few days of use, but if this were not fixed already it would have dismounted in the first 45 minutes... that's how often and how fast it was occurring. so it would seem the problem is solved. The new SD card makes the phone even more responsive when moving between pictures in the gallery and performing other tasks like copying files to the card.  Thanks SanDisk!  Unless I update this review by next week, you will know that the problem has been fixed.Good luck to those with similar problems as we now know how to get it fixed thanks to SanDisks great responsive customer service.Update: 08/31/2013 - This is the last update to this review just to ""close the loop"".  The new replacement card from SanDisk has been running flawlessly for about 2 weeks now.  I have not experienced any of the initial problems.  SanDisk really did fix the issues in the new batch of cards.Update: 12/09/2013 - The card has been running in my GS4 flawlessly since replacing it around Aug 21st.  Pretty good track record so far (~ 3.5 months) so it appears to be fixed with the newly manufactured (replacement) cards.For those that have left comments that I should change the rating upwards now that the issue is fixed (see my addition at the beginning of this review)... When searching for a solution to a problem with a purchased product, most people start at the 1 star reviews to see what others have experienced.  This is especially true for products with a lot of reviews (this is what I did in the beginning with this product).  Therefore I think leaving it at 1 star and adding the comments at the beginning should clarify the review.Thanks to review commenter ""Da Shocker"" for his input.  I think he sums it up very well when it comes to the value of files stored on media like this:""One more thing.. to those not happy with the one star rating by this person go ahead buy one. Take tons of pics vids and save some music on there then when the card crashes come back and give it a five star. A card cost $50-$100 pictures from a vacation or family event are priceless.. """
1.0,"The 64GB card I purchased actually contains 4GB of flash memory and some kind of hack that causes it to appear as a 64GB drive in various drives and readers. Of course, this took me a while to figure out since I only just got around to copying more than 4GB of data to the card, but with some testing I have nonetheless discovered this to be the case.The card I bought was in Amazon Frustration Free packaging. I don't know if cards purchased that way are less likely to be counterfeit than retail packaged versions, but I suspect that I will stick with manufacturer packaging from now on."
1.0,"I have purchased 2 of these cards.  I have attempted to use them in my GoPro HeroHD, Samsung Galaxy S4, Asus TF700, and in all of them they end up corrupting out of the blue with no warning.  I then have to perform a deep recovery to get the files.  I will never buy these Ultra models again."
1.0,"I'm so disappointed in SanDisk. I bought this for my Galaxy S3 phone. Worked great for the first few months. Suddenly I noticed some pictures were missing. Then it kept giving me an error that the 'SD card has unexpectedly stopped working' then i tried popping out the card and popping it back in. Now it says unrecognizable files and it asks to format the mp3's I had bought and stored on the microsd card. In a pinch just to see if this would fix my issues I formatted the disc. Now I lost everything and it is still giving me issues. Read some similar issues from other customers, now I'm regretting my purchase. Save your money and headaches and buy something else!"
1.0,"April 2013.  I have had the card for about 4 months and seemed to work fine.  I use it to store additional files on my ultrabook as the solid state drive is small (only 128GB).  About a month ago, the card could not be recognized.  It only lasted about 2 hours, so I thought maybe just a momentary blip.  However, this weekened, it cannot be recognized at all and it has been 3 days.  Sandisk support is not available until the week, so I will update on tech support soon.  However, I did find that the SanDisk indicated there was a defect with some of these cards.  I assume they will replace it, but I have lost lots of hours and a lot of pictures... so I am really bummed and frustrated.From SanDisk: ""SanDisk has been made aware of potential product issues involving a very small percentage of its 32GB and 64GB SanDisk Mobile Ultra microSD cards. Under certain circumstances the cards may lock up and the card becomes inaccessible. The issue has been identified and a manufacturing fix has already been put in place. SanDisk stands behind its products and any customer who experiences this issue with the microSD cards cards is asked to contact the SanDisk support center for a resolution immediately."" SanDisk"
1.0,"I got this product exactly 1 month and 3 days ago. Prior to today, it was working fine. Out of nowhere, my Micro SD card can't be read anymore. I've tried several phones, and 3 different laptops (both OSX and Windows 7), and it doesn't even show up anymore. Be weary of the product. You may end up with a lemon."
1.0,Performance and capacity were not in line with cost and expectations. These are most likely counterfeit or back door sales in my opinion. Very unsatisfied.
1.0,"I had this Sandisk 32Gb Class 10 micro SDHC card in a Pittasoft Blackvue DR500GW-HD in-car camera DVR. It worked like a champ for 2 months and then died with the dreaded ""Please format the SD card"" errors. Stuck it in my Mac Mini (2011) and it is unrecognizable. Same with Windows PC. Even the low level HP SD card formatter cannot reformat it. So in the garbage it goes. I have 2 more of these cards in my Garmin GPS devices and they continue to work (so far) but they are not being written to continually every day like the Blackvue. So a word of advice; if you need to write to these cards often - buy something else."
1.0,Failed after a year!
1.0,"I purchased this product knowing there might be an issue with the galaxy s4. This card worked for a week or two then began to spontaneously unmount and would mount itself back in. The unmount periods began to become longer than a few hours, days! I tried this card in a galaxy note 2 still with the same result. I attempted to contact Sandisk customer service and utilize the warranty. They know of the problem and began the exchange process then instructed me to wait for a mailing label that never came. I called back and was told that they would re-email it to me. To this day I am still waiting for that email. I have never had this issue with this company but with  ever changing technology, it is what it is, right? I know this card will be good for some device I have. If you own a galaxy phone beware!! I have not attempted to use this in a samsung tablet so on that I cannot review."
1.0,"When i got this memory card, noticed the writr protect lever was hard to move. Instead of just sending it back I tried to meve it and the mdmory card broke on hslt.I hanve many SNdisk cards and havd had no troible with them. I guess I just got one that missed wuslity conttol on the line.Dont want to buy another but what do you do."
1.0,"I bought this on October 9th and didn't start using it for about a week after I received it on the 11th. Well two days ago it died a quick death, I can't even format it! So after all these years of buying SanDisk products I guess I will give in and start paying a little more for Kingston it seems as though SanDisk is getting to be a cheaply built product. You would think that a product this small and inexpensive would be able to be replaced without cost within the first 90 days but that is my fault for not reading the fine print so lesson learned. Buy it right and buy it once so go with something else!"
1.0,"As the title says, the card I got is defective and faulty. The issue is, the sd card always unmounts and then remounts and sometimes it will says the the sd card is corrupted and needs to be formatted, so first I tried to format it using my cellphone (xperia play) copied all my files again to the sd card and it gave me the same error tried 2 other phones (inspire 3g and Samsung Galaxy S4) still same error, then I tried to take it out and put it in my computer and manually format AND check for bad sectors and fix errors and it will not finish and says &#34;cannot continue because sd card is corrupted&#34;.  I searched google and find out the Sandisk have shipped a bad Batch of Sd cards, so i contacted the company and demanded for a return because its past due to return it through amazon, got RMA'ed and already shipped it and I do not know how long will it take to for them to send me another sd card. So now I do now have any sd card to put my files because of this situations that could've avoided if Sandisk's QA Department is not slacking off. Very disappointed customer."
1.0,"First of all I am not sure if the product i received is a CLASS 10 memory card. The reason why i say this is that the maximum write speed i get on my WINDOWS 8 system is 1.4 MB/Sec. Also i have issues with my system recognizing the card and i do frequently receive 'Disk Cannot Be Formatted' error.I am totally dissatisfied with this product considering the fact that i have a brand new laptop, Do not recommend SANDISK please check other brands."
1.0,Stopped working after a year and a half and lost a bunch of data. I have tried accessing the data useing multiple devices with no luck. Look elsewhere for an Micro SD card
1.0,"Pros:1. ordered it and got free shipping.2. got it in 3 days.3. popped it out of the box.4. popped it in the cellphone!5. Done!Cons:1. doesn't come with a hot pocket.2. Amazon won't marry me.3. took me too long to order the hell was I thinking.4. took too long to get it out of the box 1 second!-------------------------------------------------------------------------------------update:Okay  I have to bring this rating down to 1 star.... My 64gb SD card just crapped out. I'm getting the ""0x80071ac3"" code and i cant format it or copy files to it. I ran scan disk and nothing works... I don't know if i will be buying any more SD cards again from them. luckily i was able to save all my files. I've goggled this problem and this is a common problem with these cards..."
1.0,"I hope you have better luck, it has gotten a lot of great reviews, but first the sticker(!) covering the contacts on the back fell off, then the card died completely. Hopefully it's an isolated incident, but I'm trying a different brand in case its a bad batch."
1.0,"Worked fine for a month and then after about a month, the phone didn't see the card any more. Tried to read it on several PC's and none of them detected the card. Unfortunately it hadn't been backed up so all pictures and videos take on the phone are now gone."
1.0,"Bought this for Galaxy S3, worked like a charm for 3 months & then I started getting error messages on phone stating the card has been taken out or that it is not there, went on like this for a week or so & then one day gone. Initially I thought it was problem with phone. Popped in a 2Gb card from BB & it worked. Popped this one into the BB & same, no detection. After spending so much on an SD card its disappointing to see it go bust outside of return period."
1.0,Bought this for my Samsung Galaxy Note II.  I started having all kinds of issues with recording photos and movies to the card.  It would look like it worked and then when I'd go back to review the photos or movies they were corrupted.  I see other people having the same issue with these cards.  Lost memories - bad card...
1.0,"I have not had many problems with what I have bought over the years, but when I do I will make sure to warn others. I loaded a handful of videos from my PC and then installed this in my Android tablet for a trip. Corrupted. Nothing worked and sometimes it can be seen, other times it doesn't even show up. The tablet wants to format it, which it has never been able to do successfully, and needless to say it is too small to even be a paperweight. The SD adapter that it came with was also junk and upon the first time I went to use it, it simply didn't feel right--- so I used my trusty Lexar micro SD to USB that came with my Lexar 32gb micro SD card.I would have expected more and unfortunately as it stands many people have success with them working and equally those that do not. I have even formatted it to see if it made any difference and there was none. And of course my window of return is gone so unless the seller stands behind it--- it is going in the trash. I knew I should have gone with what I had purchased before as I have three of them working perfectly for over a year. Moreover what is even a bigger disappointment is that our camera that uses a standard SD card and it is a no-name with no identifying marks---- has worked for two years without a problem.I do know problems arise, but..... when the cost of a product goes up and up and the quality control goes down--- I am not going to be the one accepting those terms. If you're looking for a good card, search Amazon for this one: LSDMI32GBSBNAR. This is the Lexar and I have thousands of pictures, video clips, and it has even endured three updates to my phone--- plus I carry my phone everyday so it is subject to everyday life all the time, it has been tough stuff."
1.0,"Picked this up on sale.. doesn't work, only shows up as a 1MB (yes, Megabyte) card that I can'd do anything with.  I already threw away the original packaging too.  I'm sure returning it is going to be a huge PITA because of that.UPDATE: After writing this (albeit, short) review I found this is not uncommon.  I also found that this card was deliberately crippled despite the product description saying ""The SanDisk Ultra microSDXC UHS-I Card works with any microSDXC compatible device.""  That was all the motivation I needed to process a return on it rather than having it replaced."
1.0,"Within an hour of using the memory card, it failed and died. it kept saying &#34;Memory error.&#34;I could never get my dashcam camera to record anything. I went to our walmart and got me just MicroSD not Ultra. It has been working all day so far.That's right. There is no way to tell what you are getting online is OEM or knock offs. When the price is too good to be true, it probably is - made and distributed by Mofia. LOL.Although the package arrived on time, I will never buy this product online or from this seller on Amazon. Waste of money."
1.0,"Beware guys. i bought one of these from Superior Electronics Outlet and it arrived completly dead. i tried to format it on windows and on my galaxy s3 and no go.I tried everything that possible ....have been fighting with this card for 3 days now, and no success so far. No response from the seller about it.My last hope is amazon refund me. otherwise  i just wasted 80 U$"
1.0,"I bought the SanDisk 32 Gb micro SD card (class 10) in Dec for a new Galaxy S3. I used it for songs and video and pics. It started acting flaky in April and would unmount itself and then remount and I had problems with playing music. Then it completely died and would not even reformat. This is a known issue, and I will write back after I try to get SanDisk to replace it."
