overall,reviewText
1.0,"Worked great in my galaxy s4 and died about 2 months later, what a waste of a lot of money!"
1.0,Got this product and it was fine until it just stopped working...The last one I had that came with my DROID X on release day worked for the whole time since I got it without a hitch...I get this one and it's dead in less than 60 days...I don't know if I got a lemon myself or the whole supply is bad or faulty... All I have to say is I am very displeased!
1.0,"With all the great reviews on this card, I picked this up for my Samsung Galaxy S III. Popped in the card, and I was happy taking pictures, saving files, and living life.Fast forward two months later, and all of a sudden, the card stops functioning. My phone won't read it any more. My computer won't read it either. Submitted a ticket to Sandisk. Hopefully I can get a replacement that actually works.Thank goodness I saved all my photos on Dropbox."
1.0,"i still own it but card went bad after 2 weeks of owning it, lost tons of music and data ect and lost all faith in sandisk products. i tried to get it replaced or money back but no return email from seller, so unhappy i lost over 20gigs of movies/music and data. wish there would have been a reply from seller or amazon but i still have a dead sdcard with all my files stuck on it."
1.0,"This card no longer is readable by three different phones after only six months of very light usage (very few pictures had been saved to the card), where it was never taken in or out of the phone before it showed signs of dying (thus the death was not caused by excessive handling of the card)."
1.0,This is a piece of crap. This is my 3rd card in 3 months. This is ridiculous.Do not buy this crap
1.0,"Although Amazon claim it is a C10 ultra fast Memory Card, it actually has much slower write speed than other C10 microSD card (it only scores about 60% of the normal speed). For example, I have tested it against my old Maxell C10 HC microSD card. The test was done by writing the same 3035MB random data from DRAM to empty microSD card through a USB3 card reader. The resulting time was the average value from 3 tests of each device:SanDisk Ultra 32GB C10/UHS1: 5m50.816s means 8.7MB/sMaxell C10 HC: 3m38.787s means 13.9MB/sThe speed is completely unacceptable for a Class-10 claim (13% lower than 10MB/s, the lowest boundary of Class-10 device), even the over-advertisement of SD card speeds are common (claiming 30MB/s for actual 12-15MB/s). It is almost a scam. Some Class-6 card will beat this ""Class-10"" card."
1.0,"I bought two cards for tablets.  The first wouldn't format, so I bought another GSkill Class 10. The second worked, but only for 3-5 minutes. Then error, or freeze.  I thought it may have been the tablets.  However, the Gskill worked in both.....So I called Amazon.  The customer service was excellent.  There ""may"" have been a problem with one of their vendors......They shipped out two new cards with Saturday delivery.  It was ""implied"" through lengthy conversation with the Amazon Agent, that there were numerous problems with a particular company/vendor.Lesson:  Do NOT Hesitate To Call And Return if you get a card that seems to have ANY troubles out of the pack.I was surprised that my initial review was removed  from Amazon....So I am leaving another about the return.  II tried everything to fix these cards: fat32 ntfs and the newest exFat.....  There are definitely some damaged cards out there so be wary, and do not hesitate to call customer service!"
1.0,"I purchased Sandisk because i thought it was the most reliable name brand out there. I have a Galaxy S3 and purchased this 32GB card to handle all my photo's and movies. I'd say over the last 4 months I haven't been using the storage for more than just photo's and the occasional movie. The device just failed on me yesterday, losing all my photo's and files. Thank goodness for DropBox auto-photo upload otherwise i would of permanently lost my photos.I actually went back to the Amazon branded microSD card (16GB) which is about as fast and so far, way more reliable than sandisk. I can't beleive a sandisk card failed, I'm probably going to RMA the unit and hope they send me a better unit. You can guarantee that i'm going to burn in the card to make sure there's no errors.I gave it one star because you think you pay a premium for a premium product. You expect it to be as near flawless as possible."
1.0,Had the 32GB SD Card for a 4 months before it died on me. Tried to swap it out and said warranty was only 60 days long. Last SanDisk product I ever buy.
1.0,I have lost my data 3 times with this card. I don't know if it's the card or the S3. My data always ends up as unrecoverable pieces in the LOST.DIR directory the phone creates the first time you insert the card. I don't trust it to hold anything I cant afford to loose.Update: I purchased aKingston Digital 32 GB microSDHC Flash Memory Card SDC4/32GBlast week as a replacement. It hasn't lost any data yet. I'll update here again if it has the same issue.Update 2: TheKingston Digital 32 GB microSDHC Flash Memory Card SDC4/32GBhas been in my phone for 2 months with no data loss. It is the better product.
1.0,"Spent over $50 and the thing came fast and didn't work.  Neither my computer nor my phone could read it or format it.  I have had plenty of memory cards, so I know to unmount it with software.  Odds are yours will be fine, mine sucked,"
1.0,"I guess I should be happy it failed after only 1 month, because I only lost 1 month's worth of pictures etc.  I bought 3 of these cards for my wife, son and I.  My wife's had a minor glitch, which went away with a reboot.  Mine had a minor glitch this morning, so I expected the reboot to fix it.  No a reboot caused my Motorola Defy XT to tell me the card was blank and needed to be formatted.  My laptop won't even recognize the card when I put the card in it's reader.  After a couple hours of looking for a way to fix it, I have only found that this is very common for this specific card.EDIT: I was very happy with Sandisk after calling them.  They did say there are compatibility issues with CLASS 10 cards and some of the Android phones, and verified my phone is one of them.  They offered free replacement with a card that would be certain not to have the same issue mine just had, and also to attempt recovery of my items from the card.  These are the reasons we buy sandisk in the first place.  They did recommend a Class 4 or lower card to me for this phone.I am leaving this as a 1 star, because people should be aware of compatibility issues this severe.2nd Edit:  As of March 12, this replacement card, that wasn't going to ""be susceptible to the same type of failure"" is losing apps etc.  I am giving this card up.  It has taken my phone and turned it into a device I cannot count on."
1.0,"Atto Speed rating 2.7MB/sec write and 2.8MB/sec read.That barely makes it class 2, not class 10 as advertised.This is second time I have to return a slow card, I hope negative reviews will help bring attention to the widespread problem."
1.0,"If this was any more worthless, it would have a retched stench.  This card has completely turned me away from ever trusting another SanDisk product again.  I would only use this in the future to keep corrupt mis-information to frustrate anyone attempting to acquire any of my data.I have reformatted it 3-4 times IN FULL using various allocation sizes and operating systems.  It only functions under Windows, it randomly works in my mobile devices.  Now i'm left to decide if I want to bother researching this to better understand the problem in the future, or simply purchase another card from a more reliable manufacturer...... hello Kingston."
1.0,"If you have a Contour camera you want to use this with. It will not format! Don't even bother.Now I have room for about 16,000 photos. Not what I wanted."
1.0,"memory card failed mysteriously overnight, not sure why, but phone works fine with a different card.here, four more words"
1.0,"I got a card and it wouldn't let me copy files to it, it would (a) not recognize on any of the three computers or my android tab at home, and (b) unmount itself in the middle of file copies.  These two things happened randomly.  I got a replacement, but it suffered from the problem of letting me format it (yay, farther than I got with unit 1), then crapping out 300mb into a file transfer.AVOID THIS GUY."
1.0,"Could not figure out why this card crashed multiple times in my Samsung Galaxy SIII, and demanded a reformatting. Then after 5hrs of calls to Sprint & Samsung I got a guy who reads factory stuff!Samsung Galaxy SIII is a Class 4 & Class 6 supported Motherboard, with Qualcomm processor. The Sprint stores only sell Class 4 memory, and there is a reason that Camera memory~Class 10 is not sold there, the board, just like in a PC, has to support the data stream. It does not!If you have an Android Phone you better make sure the motherboard supports it! Even Samsung's USA website does not tell you the board supported memory! They won't, and don't tell who the board manufacturer is in this Galaxy SIII phone. I asked at the Texas Samsung advanced tech support center after 1hr on hold, and they had no specs to even share. They don't get it!PASS IF YOU HAVE A CELL PHONE, UNLESS YOU GET IT IN WRITING FROM THE MOTHERBOARD MANUFACTURER OF YOUR PHONE. I went through this same stuff building custom PC's with Intel motherboards. Memory has to be built to run on this board, at this speed, with this processor, or it will not work properly, and will crash, and lose data."
1.0,"I purchased this card (the 64GB version) to use in a Samsung Galaxy S2 phone. It worked perfectly for almost three months, at which point it just stopped mounting. The phone detects a card, but is incapable of formatting it. It's even worse on my computer, which does not even detect the card anymore (and yes, I'm using an SDXC-compatible USB reader).I contacted SanDisk for an RMA and they will probably replace it, although the replacement process is needlessly slow and painful.I had bought this card based on the glowing reviews, but I'm going to stay away from SanDisk products from now on."
1.0,"I hate it, it worked fine for 2 months and the after those 2 months it started with problems, first, every once and a while was not recognized by my device, and now 4 months after, I have to pull it out and then place it again in every hour.....It might have been just my microSd problem.... But I wont purchase one of this ever again"
1.0,Don't even waste your time buying this memory card. 64GB is written on it but its actually even less than 3GB that's in it.i have never experienced such deception.i had tried loading my pics and music and other data on it from day one but no matter what i did i won't take more than 3GB of data. i didn't realise till i read other stories of similar memory cards that will state 64GB but would contain a smaller memory capacity often times even less than 10GB.i bought this card for $49.what a big waste!!now i am so scared of buying memory cards on amazon or online elsewhere.i wouldn't dear it again!it was in a sealed  sanddisk packet so i was thinking it must be original.Alas!it was a big  waste!i have lost confidence in buying memory card on amazon.
1.0,"I've requested a replacement, so I'll update this review after I receive a replacement.  But the first card I got, it could be read, but every time I put it into the computer, it said there were errors with it.  It couldn't repair the errors.  I couldn't even format it using a command prompt to try and get it to work.  I could create folders on the card, but not put anything into them or onto the card other than folders.  I tried many many things and nothing worked.  I know SanDisk makes decent products, so I will change the review later."
1.0,"I wanted to believe that those people who wrote bad reviews on memory cards were just unlucky. Well it sucks being one of them. I cannot get this card to format not matter what device, software or technique I use. The mistake I made was that I didn't use the card right away to see if it was good -I thought, its a memory card, what could go wrong. Now I'm out of the US and returning it is not economically sensible. I don't know if it's quality control, but this card simply cannot work in any reader, device, with or without adapter (write protection off on the reader of course). The card shows up on devices, may even show data being copied then when you refresh, nothing has happened. All formatting software says it's write protected and nothing I do can remove it. Why would a new card come write protected anyway?  Very disappointing, especially since I lost data from my phone."
1.0,"These are genuine Sandisk memory cards, but from a defective batch.  I lost all of my photos and videos taken on my phone over the last two years because the card had a catastrophic failure.  SanDisk reps informed me the batch was bad and they were aware of the problem."
1.0,"I bought this card and it worked OK, at first. After about three weeks I noticed that some images were not showing up, a week later it began to loose everything. My Note 2 was failing to recognize it, inserted into the adapter and my comp could see it but not read all the files. Multiple formats by either the comp or Note 2 did not fix the problem, even tried some tools that I used for my DSLR, still no-go.This could just be a batch problem as the card looks legit and was fast in the beginning."
1.0,"forget loading this into your cart.  a one day pause and this junk went up 16.99, in ONE DAY.  I don't give money to aXXholes."
1.0,"I didn't  even have this card installed in my Motorola  Razor HD for 6 months when I turned my phone on yesterday and got a message stating I removed my card before properly unmounting it first even though it was still installed. I plugged it into my PC adapter and nothing! I lost about 300 documents and over 500 pictures, but i'm glad that I just backed up everything 2 weeks ago. Worked great until it died far to soon and without any warning at all. Be sure to backup all your important data frequently!"
1.0,Sandisk has the name but in my experience the quality and speed is not there. My lexar lasted longer and outperformed this chip.
1.0,"Ordered it on 1/10/13, never received the first 2 sup[posed shipments then 32 days later an envelope arrives with a counterfeit SD card that was detected as fake with H2TESTW software after writing only 71mb's it crashed several times. No hologram or individual serial number on the Chinese knock off packaging either. Make sure you know where they are coming from! Only buy these from reputable authorized dealers! It's worth the extra couple bucks to avoid this frustration!"
1.0,"A month and a half after purchase...  My device powered off while the card was in use (batteries ran out).  Since then, doesn't work.  The device doesn't recognize it.  Doesn't respond to recovery, reformatting, partitioning... nothing.  I've used EaseUS, ZAR, HP USB Disk Format, and a couple others.  No dice.  Nothing can read it or fix it."
1.0,"Received two today and they have ""Made in China"" imprinted on them.  Although they were detected and formatted fine to capacity in both Samsung phone and tablet, lets see if they hold up and not suffer premature death like many have reported.  Thinking I should've gone with ""Made in Korea"" Samsung SD cards instead if they had 64GB size.Update: Bought two 12/2012 and one year later with very light use one of the cards started locking up the phone with ""wait or close"" prompt when deleting files off of it.  Should've gone with Made in South Korea Samsung card.  Sandisk is garbage these days."
1.0,dont even bother to try - will not show up in finder and will not show up if placed on any reader
1.0,"I got this for my Samsung Galaxy Tab 7.7 (p6800) and it worked great for about 3 weeks - September 18 through today, October 7.  It just died while I had the tablet attached to my PC and was copying another file onto it, so I've changed my rating from 5 stars to just 1 star.  I'd give 0 stars if I could.  Another user warned me that this had happened to him after 4 1/2 months, but 3 weeks?!?!?!?!?  I've reported this to Amazon and asked for a refund.Stay as far away from this card as you can, at least for the Galaxy Tab 7.7.UPDATE:  Amazon refunded my money for this card, and I replaced it with the Samsung equivalent, which is STILL working perfectly.  Don't waste your time and money on this card - get the Samsung."
1.0,after 4 months it stopped working i got a new one form SanDisk but I'm very apprehensive to put it on my phone.
1.0,"This is one of those basic items that usually just work. In my case, I received one that just did not work. A couple of weeks ago, my phone reported an error and so I reformatted the card and transferred my music back onto it. Unfortunately it failed again two days ago and it won't even format now. I have had good luck with SanDisk before, but this one was not a good experience."
1.0,"I just don't get what has happened to SanDisk quality.  It seems to have gone down over the years.  This product was glitchy from day one.  I thought it would be fine after a quick check disk, but then it only got worse.  After less than a week I have to return it.  What upsets me is that this is not my first bad experience with SanDisk products.  I used to buy them all the time, they were my brand of choice for flash memory (cards or thumb drives).  The last three products I have bought from them have had problems and failed either immediately or shortly after usage.  So I give up.  I will start looking to other companies for my memory needs.  I bought a Transcend to replace this.  I hope it works out better."
1.0,I should have known better. Everyone is complaining about this memory card if you read reviews on specialized forums. Last time I buy anything from Sandisk.
1.0,"Broke after  2 weeks.....I will go back to Samsung HD cards... This was a waste of time and money. Actually, I should ask for a refund"
1.0,"I have zero complaints, this card does exactly what it should. I'm amazed by how inexpensive memory cards continue to get. These things are really useful to throw on your keychain because they're so small.Update: From 5 stars to 1. Dead after 4 months. Appears to be a fairly common issue: [...] Let's see how the RMA process goes...."
1.0,"I got this for my brand new Nokia Lumia 810, but there is some kind of problem, the card is horribly slow, I can't record HD video to it, it studders.  I've tried reformatting several times to no avail.  I didn't have any of these problems with my old 32gb class 4 sandisk card...  There are other people having this problem as well, seems hit or miss.  I can't recommend this card at this time for this reason.EDIT:  I've contacted SanDisk and they are RMAing the card.  I'll improve the rating if the new card corrects the problem.EDIT: Got the new card, problem still exists...EDIT: I've suffered with this card for a year now, the only problem is that I cannot take video without studders, so I figured maybe software updates would eventually fix the problem.  They have not.  I have used multiple different camera apps, and the problem still persists."
1.0,"Major issues, bought FROM san disk but only worked briefly, now when I try to reformat it reports itself as a 30 meg removeable drive in both windows and macos--not sure if its defective or a mislabeled one--but got direct from amazon so just very disapointed. Will stick with transcend from now on I think."
1.0,"after doing some tests between a generic memory card and this sandisk i am very disappointed. i bought the 32 gig class (10) card.i swore i picked ""original packaging"" but it was shipped with out original packaging... i will be returning this card for the following reasons:these tests were done using the sd card ports on my pc.my generic class (6) 32 gig card has upload speed of 22MB (write) and a transfer speed of 8.5.my sandisk i just bought, it has an upload speed peaking at 32MB (write) and a transfer speed of 6.5 to maybe 8.5 if im lucky.the write speed is ok, but why is the transfer speed so much more low. why isnt it at least 10MB if not 12MB if sandisk is typically so modest in their classifications?and whats the deal with the no classification marking on this sd card... i dont see class (10) anywhere on this card....amazon you will be getting this back!"
1.0,"First, it kept unmounting on the Galaxy Note 10.1I got it replaced.I used the replacement on my Galaxy S4 and it heats up my phone when charging. IT GETS VERY HOT. GS4 does not get hot with other sd cards. awaiting my second replacement."
1.0,Piece of crap died two months after I bought itI am sure that makes it on me to buy anotherGREAT!
1.0,"Used it in a Samsung Galaxy S3 and it was ruined within a month.  Second one I went through on that phone.  Contacted Verizon, Samsung, SanDisk, Google, and read a lot of forums.  Turns out a lot of people were having the issue with that phone and these cards.Of course the girlfriend threw away the card so I couldn't return it, so I don't know if the issue was fixed or if was a bad batch of cards that went out or what.  It's been a few months and I haven't seen the problem as much as before, so I can only assume it was a bad batch.I've had another card in my phone for a while and haven't had any issues, so for now I can't recommend this specific card unless their issue has been addressed."
1.0,"Do not get this card especially if you plan on using it on an Android phone.  just google ""sd card unexpectedly removed"" and I found the problem is caused directly by this card.  I purchased a different brand and the problem immediately disappears.  Out of curiosity I tried mounting this card into a windows PC and on rare occasions the sd card does turn up empty, as if it was removed, so the problem is not limited to android.  I would avoid this card completely."
1.0,"I bought this with Costco Black Friday deal and started using just a couple of days ago.  Today when I was transferring video files from my phone to the card, I wasn't able to because it stopped half way.  Now, nothing can be written on it.It was purchased from Costco, so it's not a fake Microsdhc card.  I tested it out its authenticity with an app on Google Play and verified that it's real too.  Still, it's a piece junk.  What is Sandisk doing to its reputation?I would advise shopper to choose other brands over this.  Surely, it's cheap; but would you rather lose all of the important files that you store in it?"
1.0,"After a small preasure while trying to remove it from a device it got brokenAlso, the I/O speed is not amazing, even for a Class 10"
1.0,Just started unmounting and remounting all by itself.  Really sucked the battery life for a while there. A quick google search showed this to be a common problem.  Oh well...
1.0,Crashed... Lost everything... Thanks SanDisk.  Used in gs4..not a solid product couple years worth of stuff gone in an instant.
1.0,"These have issues with gopro, do not use. The transfer speed is inaccurate, and gopro has even admitted it doesn't support this."
1.0,"I ordered this memory card for my Drift Ghost-S action camera. I started getting errors and the camera was freezing and saying there was a storage problem. I assumed the camera was faulty and actually exchanged it for another camera. Same errors. I switched to a SanDisk Extreme card and never had problems again.If you're going to be recording HD video, especially at high frame rates then do not get this card. I'm sure it would be fine in any other scenario though, but it's advertised as a class 10/UHS 1 card and it's just not as fast as other class 10/UHS 1 cards.Drift Innovation (the company that makes the Ghost-S camera I use) has stated in multiple support tickets with me not to use any ""SanDisk Ultra cards"" because they do not perform fast enough for the camera and will result in slow card errors. They work ok until you try recording 1080p video at higher frame rates."
1.0,"It worked fine at a start and offered great speeds, but after a few months my cell phone started to eject and reconnect it several times per day (at least once per hour).  That made my phone eat up its whole battery life in half the time.  I installed Watchdog and noticed that the Google+ process also incremented its CPU usage.  I read somewhere that it was caused by this kind of problems with microSD cards, probably because the process was trying to scan the memory once inserted.  In another forum there are also reports of this kind of problems with some of the latest generation SanDisk microSD cards.Now I decided to purchase a Samsung one which can be found similarly priced.  My phone stopped acting up, and its battery life came back to normal."
1.0,"Fast card while it worked.  Died less than a week after return period expired....  Must note though that that is the nature of any memory storage card or drive.  Some fail, some last forever.  Not SanDisk's fault, not amazons fault - it is what it is.  BUT it is for this reason that i think Amazon should extend the return period on items which fall into this category.  Dont worry amazon, i still love you - but feel like your played the role of a proctologist on this one..."
1.0,"I bought it for my new galaxy note and I realized the device didn't recognize it...tried it on other devices, laptops, desktop, macbook didn't work...Very disappointed !"
