overall,reviewText
4.0,"Fairly fast MicroSDXC card.<br /><br />Average speeds were Read 19.77 MB/s, Write 19.00 MB/s on my non-UHS-1PC."
4.0,"Good Quality and look, for some reason it weigth more than my other cases and the original smartcase."
4.0,"Plays real good, not as loud as I thought but does the job"
4.0,"I wrote a negative review based on the fact that the product failed just after my return &#34;window&#34; closed on August 15. I had only used the hub for a few days. That was obviously disappointing, but Pluggable support came through and sent me a replacement item that seems to be working well.    I like the functionality of this product and hope the second time is the charm. I bumped my rating to 4 stars from 1 with the expectation that the flawed unit was an exception. Fingers crossed."
4.0,"Smaller than I thought, but I ordered another one since I needed more storage card sleeves. Serves the purpose."
4.0,"I like that it's not bulky and provides a sleek, professional look.  The blue cover looks classy"
4.0,To long of a shipment window.
4.0,"I've ordered two of this monitor. Both of the monitors work perfectly.<br /><br />the only thing I dont like is that the bezel is half an inch into the screen, as well as the frame of the whole monitor. AOC does this a lot though, so its expected."
4.0,"Range of this router is quite good. We have a 1 level 2000 sq. ft. house and the router sits on one far side of the house (roughly 70 feet from the other side of the house) and it reaches everywhere in the house and beyond. The previous router (Trendnet TEW-812DRU) could not reach the carport so I would need to turn off wifi on my phone when setting up for a drive (start navigation, begin streaming audio, etc.). However, 39 days after ordering, it died. We left home and the wifi was on and working. When we got home, the router was completely dead. Lights will not turn on, nothing. I tried another outlet but no dice.<br />Thankfully Amazon extended the return window to 45 days for me and has shipped a replacement (called Saturday morning, arriving Monday). However, going without a wifi network for a weekend sucked and it is frustrating that the product died so fast. I have taken off only one star for the time being but I will update if the issue happens again."
4.0,colors are awesome and even in bright light this is super bright and visible. only thing is a couple of the keys stick
4.0,Love this lap desk. It suits my needs so I use it most of the time.  I just wish the space inside was slightly deeper so I could use it with a tablet protector of some type.  Also I find the latching mechanism to be nearly impossible and need either a table knife or my husband to open it.
4.0,Love it. Works perfectly fine
4.0,easy to hook up
4.0,"Comfy, easy to clean, and stays cool!"
4.0,My grandchildren really like the 3 fires hd 6 i purchased.  My only complaint is the memory and lack of SD slot.  I knew that when I bought the 3 fires.  I purchased Kingston 5 in 1 and loaded movies and music for them.  That seems to solve the problem.
4.0,"I plugged it in to my Widows 7 laptop and it worked fine. I read in 25 old floppies that had picture files without a problem. It is interesting that some of them read in very slowly, and others quickly. I have no idea why, but with this stuff, patience is a virtue. The only problem is there are no instructions for it included, so for a user without skills in managing windows file tree, or knowing how to install hardware there could be a problem."
4.0,Good product
4.0,great it works amazing for a low price headset if you are looking for one that is cheap and really good i recommend this one
4.0,Good
4.0,Very comfortable
4.0,Perfect length
4.0,As advertised
4.0,I'm always looking  for the perfect light ray slim protective cover for my iPad Air â€“  this cover is light and easy to use - wish it was a little bit lighter but it's better than most.
4.0,"I bought this to replace a different plastic cover which had chipped on the rear corner and would no longer hold my baby iPad securely.  The material in this new one appears to be sturdier.  I'm not sure what the material is, and it may be manufactured leather, but it does not feel like soft natural leather like I have on my large iPad."
4.0,"Birght LCD Screen, Good Construction. Works okay with Rosewill Power Supplies but some other third party ones (Such as Hi-Pro supplies manufactured for dell systems) don't work."
4.0,For the price it is a great deal
4.0,I initially purchased a G930 Wireless headphone which is exactly a G35+Wireless. Didn't like my connections getting dropped frequently due to crowded 2.4 GHz. It's been a good decision to return that product and get a G35. No Battery issues either; and cable length is long enough to move freely around.
4.0,I was a little disappoint that my keyboard will not connect but it will plug into the dock. over all I would recommend it.
4.0,Works great on Jambox
4.0,Great bag set. I get so many compliments. Few people also made a purchase. It's durable. But compact.
4.0,"Good bag, the strap is a bit short but works very well for the intended purpose"
4.0,"This cooling pad has lasted a lot longer than any other cooling pad I've purchased, and it's super quiet."
4.0,I used to have Comcast with 50mbps  I have 30mpbs with CenturyLink I get better wireless signal on my computer downstairs in my basement then I did with the Comcast Modem.  +
4.0,good product
4.0,This inexpensive little microphone works great with &#34;Ok Google&#34; and Windows 10 &#34;Contana&#34;<br /><br />If it keeps working like I expect the 4 stars will be changed to 5.
4.0,Exactly what it says it is. Handy for my phone. Price was good
4.0,Would be great to be aware of the directional nature of the connectors. There is one end which goes to the source! It does not work the other way around. I understand why just wasn't thinking that it would apply to HDMI. Love the length though...this allows flexibility in placement of equipment to each other.
4.0,"Solid build, works as advertise so far."
4.0,"Disclaimer: I received the AC750 as part of the Netgear Friends and Family program at no cost.  I have this Wi-Fi extender paired with a Netgear C6300 cable modem/router.  The cable modem is upstairs in a closet and the wifi extender is downstairs in a central location in our house.  So far the success rate of the Extender has been pretty good.  It has definitely extended the range of my C6300 I have; however I have noticed unreliable connections to the dual-band SSID on my network.  I probably am able to get it to connect about 90% of the time correctly.  The other times I fell back to my AT&T signal in the house on our iPhones.  Installation was straightforward and only took 5 minutes to get it going.  For a quick solution to extended your wifi range, you really can't go wrong with this setup."
4.0,"so far fast and reliable, no problems two months in."
4.0,"Good length, but not very pliable."
4.0,Not as comfortable as I would have liked but I guess I just have a big head:). Still it sounds amazing for the price!!!
4.0,"I do love it but for some reason it keeps freezing on me.  Ever since I received it, it freezes up on me quite a bit to the point where I have to shut it down and then start it again.  When it is actually working properly I love it!  Since that is my only complaint, I give it 4 stars."
4.0,good enough. does the job.
4.0,"I was on vacation in Hawaii when my iPad charger crapped out.  Instead of paying $75 for an apple charger locally, I bought this one.  Feels light, however it gets the job done."
4.0,"soft, and useful"
4.0,NetCam was exactly as advertised and performed as expected
4.0,its good for the money
4.0,good price for good product
4.0,"It worked great, good quality cable"
4.0,works fine.
4.0,awesome. is not a big mouse but still awesome
4.0,So far the tablet has been great! I'm using it for online textbooks and homework! It has treated me well thus far!
4.0,A co-worker wanted this item and loves it.  It puts the keyboard at the perfect angle for her hands.  We may order more for others in the office. It's not real heavy but thick enough to be sturdy.  Should last a long time.  I have a similar item (same thickness) for my calculator and have used it for 20+ years.
4.0,"Hardware? Outstanding! Software? Horrendous!<br /><br />This item is tiny and works extremely well.  It comes with a short cable to connect to your computer.  It's very inexpensive. Perfect.<br /><br />However, I strongly suggest letting Windows (7 in my case) detecting the device the first time you plug it in and see if you can do what you wish to do with generic Microsoft drivers.  I found that the device worked perfectly with that setup.  When I tried installing the included software, I was surprised to find one of those obnoxious &#34;bloatware&#34; monsters giving birth to numerous ad-filled utilities all over my PC! I couldn't wait to uninstall it (them)!  Imagine my annoyance when I found that these programs were of the &#34;self-protecting&#34; type, that hid themselves from my uninstaller.<br /><br />Horrible.  I had to dig them all out and then clean up the mess with CCleaner.<br /><br />Samsung deserves high marks for the hardware but they should be ashamed of themselves for including such terrible software to unsuspecting buyers, IMHO."
4.0,works well and as described
4.0,Better then expected!!! Super fast!! And high quality display
4.0,good
4.0,Fits my iPad3 very well.
4.0,"This is a great first mouse for those with wide hands or slaw grips.  8000 dps is plenty for a gaming mouse.  The software can be a little slow but it is very simple.  The ability to change the sensitivity at the click of a button is great for gaming and photoshopping.  I have tested the vibration damping and it works flawlessly.  The only problem I had with this mouse is some driver or software issues, but they can be easily fixed by reinstalling drivers and software.  Also the support center is great.<br />I recommend this mouse to casual gamers."
4.0,"Good product, works great, and I like the holder for the charging cable underneath."
4.0,Small for little hands. nice!
4.0,Little tedious to adjust every time you want to change height.
4.0,"My standards are low. It provides power, doesn't get too hot. Unfortunately, only two of the four original mount holes lined up. Not terrible though since it was still firmly held in place. Does what it says on the label."
4.0,"Well made, works as advertised."
4.0,"seems to work well. went on smooth, only time will tell"
4.0,good product for the price..
4.0,Works as expected and the price is right.
4.0,Good
4.0,Has really fast data transfer when plugged into a USB 3.0 port
4.0,Must buy
4.0,Works as advertised.
4.0,On the smallish side for size 9 hands
4.0,"I'm not a huge fan of touchscreen devices, though this one has its pluses and minuses.<br /><br />On the Positive Side: it's easy to put items into collections - I wish I could drag/drop items, but being able to click check boxes and easily type is a positive. The ability to select different font types and sizes is nice, and you can easily add bookmarks. My kindle just updated within the past few days and added the &#34;Bookerly&#34; font, which is Amazon's font specifically designed for kindle. It's nice, but I prefer Palatino out of the options available, so I stuck with what I already liked. The price is good, and it can hold a LOT of books. The screen is also easy to read, even outside in bright light.<br /><br />On the Negative Side: The touchscreen is really sensitive. If I bump the kindle, all of the sudden my font is huge, and then I have to make it smaller again. Or I'll find myself on another page. I appreciate the ease on turning pages, but constantly having to readjust my font every time my cat decides to bump the kindle, or if I put it facedown on my lap for a moment, is really frustrating. There also isn't a built in light on this model, so you need to get a booklight or make sure that you have adequate light to read with.<br /><br />Overall, it's a good kindle, but I miss my buttons... I just couldn't afford the version of the kindle that actually has buttons now!"
4.0,Looks very good on my mac
4.0,Over a year and still going strong. Wish it didn'y tear a bit. Otherwise it's perfect!
4.0,good
4.0,"Works great, but could be a little smaller."
4.0,DID NOT NEED IT
4.0,Great value. Thin and fits well.
4.0,works great
4.0,Nice little keyboard cover. Matches my office colors and it's nice to have a little barrier to protect the keyboard from getting really dusty and dirty. Easier to clean this way. :)
4.0,"Great bag, just really small, my charger can't fit inside the bag"
4.0,Nice product I recommend
4.0,Got a call from anker and sorted my issues out.
4.0,this mouse was a huge step up from my 10 year old Logitech mouse....its super fast and sensitive but the setting are customizable through the software it provides you with. you can also change the sensitivity by clicking the 2 buttons below the scroll wheel. if you don't like the green you can always just turn it off. this is probably a standard size mouse its not small but its not huge.. overall its a good mouse
4.0,So far so good
4.0,good price they work fine
4.0,This cable is satisfactory.  The cable is a little thin.  I damaged a good USB cable because it was persuaded into a right angle turn which eventually broke the cable.  I would pay more for a stronger cable.
4.0,"Mostly happy with this laptop. Sometimes the mouse stops working which I discovered is a common problem with this computer. It is a fairly simple fix, but nonetheless annoying. Don't buy this if you want something with a great webcam. The webcam is VERY fuzzy and there are several recommended solutions, but so far I haven't found one that worked.  Other than that, it is pretty quick and does what it is supposed to. The sound on it is very average so this is not going to be a great laptop for the music lover."
4.0,great monitor!!! very nice!
4.0,It is what it is and does what it does: it's a keyboard. Quality's pretty great.
4.0,It works well
4.0,"I do like this bag, everyone said it was great for students, which it is, but its only enough room for a few binders, a book or two, and then your laptop."
4.0,"Works fine, but came unglued because the fit of the cover is so tight."
4.0,A bit of a learning curve to get started but I find I really like it particularly if one does a lot of drag and drop. Seems to have eliminated my RPM wrist pain
4.0,Good product.  Works as well as name brand.
4.0,"Solid gaming mouse for the price, LED light actually looks cool at night, only con would be more customizable buttons will be preferred, but I cant complain for the price."
4.0,"So far, it is very nice & my son loves it."
4.0,I've never had one of these adapters go bad...I'll use these forever!
4.0,good gadget!!
4.0,"No issues with usage since I purchased this. While the body is metallic, the carriage is plastic. Latter's construction isn't as solid as I would like. But as I said, it works. Was willing to pay higher given the USB 3.0 support (but have found that most times there's no noticeable lag issues with using USB 2.0 slots)."
4.0,Very good and useful.
4.0,Very pretty and works well! Do have some scuff marks on it from normal wear and tear but would totally buy again!
4.0,good product
4.0,it will perfect if come with 1 more dust filter at bottom
4.0,"very easy to configure, straight forward options. I am a network administrator so what I find easy, others might not. The two things this unit desperately needs:<br />1) larger holes for antenna access. I had to modify the corners to get better antennas on the unit. The bigger antennas improved performance by about 20%. View image, not pretty but effective. Im sure it voided the warranty but who cares for $35<br />2) mounting options. (there are none). This thing is so small and light the power and network chords move it around with ease.<br /><br />Other thoughts, flash the firmware as soon as you get the unit."
4.0,THE MEMORY ARRIVED IN A REASONABLE TIME AND WORKED AS IT SHOULD.
4.0,This keyfolio is great. It works well and it fits my husbands iPad perfectly.
4.0,"I love it, I just wish I could download books without having internet service like I could with my keyboard Kindle."
4.0,So far I love these. The sound quality is fantastic and the color features are a cool addition. Cord is quite short though.
4.0,Very nice. Easy to put on or take off.
4.0,"The transformation is a little rough, one leg doe not rotate as much as the other, good USB however, cannot beat the value."
4.0,nice
4.0,"Mounting the SSD to the adapter was a piece of cake. My desktop did not directly support the adapter because the chassis used a proprietary sled design. However, the adapter fit into the sled tracks well and sits securely."
4.0,Perfect starter tool kit.
4.0,Works great with the Raspberry PI unit.
4.0,the RAM is installed and performing as expected. It was identical to the sticks already installed. Just expanded to 4 gig. The RAM that was installed before has been operating for 10 years in an office PC.  The new RAM is the same brand and size.
4.0,The mouse looked awesome and well constructed. It did not have LED lights as mentioned so we had to return it.I gave it four stars instead of five because of no lights would have gave it another star had it had them.
4.0,For the price  this tablet does the job. The Antroid OS system is more then sufficient to handle  your daily tasks. The display is good also. I would not agree that the battery last for 7 hours as stated in its write up. But ultimately this tablet is well worth it for the price.
4.0,It is sturdy and serves its purpose.
4.0,Still working great after all the other chargers that I bought at the same time stopped working.<br /><br />Charges fast. Reliable product .
4.0,"all worked, came in on time"
4.0,"It's great!  I wish the delay in highlighting and typing notes weren't there, but otherwise it's great!"
4.0,Worked perfectly. Arrived when stated. Worked on Windows 8.1 and also on Windows 10 when upgraded.
4.0,"As many other users noted, one of the joysticks is guaranteed to start squeaking, even after light use (less than 3 days). I took the controller apart and lubricated it, though, and the squeaking stopped.<br />It's not the most comfortable of controllers to use (my old limited edition TRON controller had ergonomic touches to it), but it gets the job done, and you get used to it. The USB works just fine with laptops, and the installation process is fairly simple, thanks to the disk. I can confirm it works with Skyrim (from Steam). I didn't do any syncing with Steam to use this controller though; I simply plugged it in and played, with no issues."
4.0,Works fine.  But it gets HOT under sustained reads/writes (as in backing up/copying a drive).  No warmer than any other device for routine use though.
4.0,"Good computer.  Not as speedy as I was expecting.  Many problems installing Windows 10, but can't fault the laptop for that.  Just can't figure out why it is so slow."
4.0,Great Design... so modern and clean. Lightweight!
4.0,I bought this to explore some of the KALI2 hacking tools. I would not leverage this as your core home wireless router / WAP.
4.0,"Crucial recommended PC3-12800 for my Toshiba L675D, but it would not boot.  When I investigated further, the manufacturer and a couple of other sites said PC3-8500!  Crucial tech support was no help at all.  He said they guaranteed the recommended memory would work and recommended against using this memory &#34;because it's for a Mac.&#34;<br />Well, I've been working on computers for many years, and I know that computers can be very picky about memory.  I've learned to trust manufacturer specifications.<br />I returned the PC3-12800 and decided to try this set, since the specs matched.  (Thank you Amazon for your excellent return policy!)<br />It works!"
4.0,excellent!
4.0,its nice...
4.0,So far it's worked great.
4.0,"I started purchasing these for our MS Surface Pro 3's (since they only have one USB port).<br />Since these have the ethernet port, I was able to stop purchasing the docking station for most of our employee's saving money.<br />I now have two plugged into the ethernet cable on the work bench and just plug in which ever tablet is brought in to be updated.<br />It works great for the HP 900/1000 G1 tablets as well as the MS Surface Pro's."
4.0,"Great replacement, however I wish it came with a 90 degree plug in so this one doesn't get broken or ruins my computer jack like the factory one had done."
4.0,"Good speed, does what it needs to do without problems. Continuous shots are great with such speedy card."
4.0,good product
4.0,"I like this bag mostly. The airport security feature is definitely a plus and it's quite spacious and has plenty of room for my stuff. The only reason I've deducted a star is because of it's bottle holder. It's good that it has an elastic band to keep it in place, but the zip is pointless (would be nice to have a double zip that locks to hold the bottle in place)."
4.0,"Four stars is generous considering how much trouble I had installing the software or getting this tablet to do anything on the various computers I tried, but I suspect these are short-term growing pains of a new product and my sense is that Wacom makes quality stuff and that most people buying the tablet will be getting a more mature product than the early release I received for review purposes.<br /><br />The installation CD relies on the availability of online driver files which I do not think were online when I first received the tablet.  I have managed to get the tablet to work (at all) on a new Windows 10 Toshiba laptop - I also tried on an older Windows 7 Lenovo, my new Macbook Air, a Mac mini, and an older Macbook (whose OS was too old according to the installation software), and my Ubuntu 14.04 desktop at work (no go).  The CD could not be read by the Mac mini and necessitated a visit to the Genius Bar at my local Apple store to get it ejected (turns out you need a wired keyboard to be sure to eject a stuck CD).  I may have actually successfully installed the drivers on my new Macbook Air but didn't know it (see below).<br /><br />After numerous hard reboots and try try again I finally managed to complete the installation process on a new Windows 10 laptop - suddenly managed to get to the finish without the system hanging, and amazingly, saw that the tablet controls the cursor, but then what?  It turns out that you have to register the product to get a free copy of Corel Painter Essentials 5 in which yes the tablet works.<br /><br />My adult son is pretty psyched about using this tablet when he saw it - he is more familiar with Wacom then I was, and I expect he will get the most use out of the Windows 10 laptop anyway, so I feel pretty good about this - I think a motivated user with some artistic ability will probably get good use out of this.  Like I said, four stars is probably generous based on my experience, but there appears to be a large community of Wacom users and a lot of instructional videos available online - I think eventually this tablet will have that kind of community support and so I am giving it an extra star for potential.acom users and a lot of instructional videos available online - I think eventually this tablet will have that kind of community support and so I am giving it an extra star for potential."
4.0,Super easy install. Works from the get go.  The only reason I didn't give it a five is because it is a little difficult to adjust one it is in place. That said. You get it in the right spot and it will stay there.
4.0,nice
4.0,"Super cool organizing gadget. The smaller straps are nice and stiff and the rubber tread grips well. The larger straps are definitely only good for larger items as they have more give in the tension. It has no problem holding something as small as an ink pen or as heavy as my iPhone.<br /><br />This one is about as wide and slightly longer than a standard magazine (think Cosmo or Popular Science). The backing is quite solid but it feels as if their are two pieces (or maybe mine just got bent in shipment?) so it has a bit of a curve where it naturally flexes in the middle. Not a big curve, but enough that it doesn't feel as substantially solid as the smaller versions.<br /><br />The pocket is small and won't hold much over a granola bar. Best used for documents maybe? I have a hard time imagining what I might put in there. The little hanging strap is a nice touch, though I can't see when or why I might want to hang it. Still, always nice to have the option!"
4.0,WD has always been my favorite when it comes to hard drives. 1 star less than 5 cause my previous one is getting sluggish after using it for a couple of years.
4.0,Very nice!!!
4.0,"Expected for category (netbook/laptop): 8.1 OS (still can upgrade); no touchscreen; limited disc (solid state); slower than usual laptop. Also, the trackpad requires the thumb strength of Larry Graham doing slapbass to engage the padbased mouse clicks.  So, in general, this category can't get above 3.  For this category: 5 Fantastic value.  Better value than even Chromebooks.     On balance. 4"
4.0,I put this card into an Alienware M17x R3 using a modified bios and tweaked drivers. It works great only thing is the seller didn't include the X-bracket.
4.0,"It is as advertised.  I had the 7&#34; Samsung tablet and now the 10&#34;.  The screen size more than doubled.  I like that.  Otherwise it's the same, just bigger."
