overall,reviewText
4.0,"Before buying this laptop, I had read some good reviews and some not so good, so I had mixed feelings.<br />Now I had it for a few days and I am very happy with it. Let me explain why.<br />First the price. It's a deal with this config, Intel I-5, DVD player, 8 Gb RAM, 1 Tb HDD.<br />For this price, of course I did not expect a SSD, but in a few months, if prices drop down, I may swap the HDD for a SSD.<br />I won't say anything about Windows 10 because, so far I don't see what is better than Windows 7 that I used with my former laptop. On the contrary, it takes some time to do correct settings if one wants to avoid all the spying which is activated by default.<br />The laptop seems reasonably happy with 8 Gb RAM. Windows 10 starts in less than 30', including a password.  I installed several of my favorite programs, including Microsoft Office and everything works fine.<br />Some people don't like the keyboard (rubber feeling) but for me it's not really a problem. Yes it reminds me of the first Atari computers in the early 80s. However, what I like is the numeric keyboard.<br />The screen is bright and OK to view movies. Beware, there is a tiny button to eject the DVD tray, so small that it is almost impossible to see it. To make it more convenient, I stuck a small white mark on it, and now it's okay.<br />Overall, this laptop is fast enough for most uses. And again for the price it is difficult to beat."
4.0,"Case is doable but is a bit more plastic-y then seems in picture. Seems durable, so far, so good! Thanks!"
4.0,"Pros:<br /> - Well made<br /> - Easy to use<br /> - Charges both my Macbook and any USB powered device (cell phone)<br /> - Decent charge (I get maybe 1 1/2 charges on my laptop)<br /><br />Cons:<br /> - Heavier and bulkier than I had hoped<br /> - Too many cables, it takes three cables plus the charging box for full operation, which is too much to travel with. I usually only take the charger and cable that connects to recharge my laptop, which is fine for most cases."
4.0,"Good drive for the price for boosting older computers, but if it was actually for my own system I would have paid the extra for another Pro or M.2 AHCI drive, since I do notice a difference, it's not a big difference but it's still there."
4.0,Good stuff !!
4.0,"I would have preferred it some other color than white, but it served the purpose."
4.0,good product
4.0,enjoying it lots
4.0,Great value
4.0,Thank you
4.0,Good for the price I paid.
4.0,Worked great on single mode fiber across town.
4.0,Works great.
4.0,"good tester, had to get this for the company and i got more for reimbursement and i get to keep this"
4.0,Nice little mouse for the price. I bought a bunch of these for the office and most people like them compared to the wired mounse that PC's come with.
4.0,"Works just fine. Feels great to hold. Has a larger mouse wheel than most mice but I prefer a bigger wheel anyways. Adjustable DPI is a nice feature, as well as the back and forward buttons on the left side. The only reason it doesn't get 5 stars from me is because the LED's stay on all the time when it's plugged in, even if the computer is in sleep mode or completely off. I'm able to deal with it, but it is a bit of a disappointment."
4.0,USB's can easily be lost.  It would be nice if there were storage on the device but it serves its purpose and great price.
4.0,"First Kindle I received had 2 very annoying shadows along the bottom as some other users have also mentioned. Sent back and the new one has much less noticeable shadows. Tolerable. I wouldn't think after years of research, testing and manufacturing these devices should have these problem.<br /><br />My old Gen 1 Kindle Paperwhite's display is perfect. Wonder why I ordered a new one. Other than that it's a great device and I read more than ever."
4.0,love this as a spare
4.0,Packing was okay but it was safe from the outside also only got a 3 stand screws for the motherboard but at all was good
4.0,"a few annoyances but in general  does the job,maybe better apps"
4.0,I didn't think I would get used to it or like it because I like holding a book in my hands but  I love it! Works great. Much lighter than expected. Excellent color and clarity. Still learning the features.
4.0,I actually haven't gotten a chance to really use this device yet. I did hook it up and downloaded the apps for my devices and it seems like it is really easy to use.
4.0,Wish it was a little more padded but its not so bad. the extra pockets are perfect for the charger and the mouse.
4.0,Its a great product does just what it is intended for although I wish it fit just a bit more snugly to my laptop as it is a little flexible which I guess is good to keep it from snapping in half.
4.0,All of these WD products work great right out of the box.  I do wish it had a broader base...or base option...to set it up on carpet with it falling down.
4.0,Works perfectly with my Samsung Tab 4 and Samsung Tab S.
4.0,"Bought for an Asus C300 13&#34; laptop. It's a very close fit. Sturdily built by the looks and a good, heavy-duty zipper; but really just a touch too small. Think of trying to put on leggings one size too small -- you could do it, but it won't be easy and might not end well.<br /><br />Hard to make so many sized things, but this isn't a thick laptop (it's just a chromebook), and I'm not sure anything even a touch bigger would fit.<br /><br />I'm a little concerned that the zipper might damage the corners of the laptop. Not concerned enough to return it (which is probably all Amazon cares about), but it's worth noting."
4.0,It is exactly what i was looking for. Thanks
4.0,Worked out of the box. Need to download there file to center and use all of the screen. I am new to Pi.
4.0,great stylus
4.0,Have had this for a few weeks now and it's worked perfectly so far. For the price you can't beat it!
4.0,"I like this product, It's sturdy and looks really nice. The size is a perfect fit for my I pad 3. One very small short coming is, it only has one position when i tried to put it upright using the back support."
4.0,Doesn't have quite the airflow of my last couple of coolers. Now I'll wait and see how long it lasts.
4.0,It took me forever to break down and give up the &#34;paperback&#34; habit but I now love my Kindle!! It is so easy and having the dictionary feature right there is fabulous. I don't have to write down the word and look it up later.  The book I'm reading now is by a British author and so many of the words and phrases are particular to England.  There was only one word that was &#34;not found&#34; so far... I recommend it.
4.0,Arrived on time; First 2 have worked ok: Haven't used the remaining 8. My first flash drive (1 gig) cost over $100. I record my own music and messages for friends and relatives on these flash drives that they can keep or reuse for other purposes for less than the price of a nice greeting card.<br />Would be 5 stars if I had tested all 10. Time will tell the rest.. VERY GOOD DEAL
4.0,"Just what I expected for a small, on the go computer that is very easy to slip into a briefcase or suitcase. I consider this a low cost step up from a traditional tablet. Just a couple on cons. When reaching the keyboard, you need to play with it a little for it to be recognized. Also, about 50% of the security updates fail. I have owned it for about 3 days and will figure this out soon."
4.0,"I love my new laptop case! I placed my order on a Thurs and I got it on Sat morning. I have a 2015 Macbook Pro w/Retina display w/ a hardcover case and it fits into the bag perfectly! The bag is super cute and stylish and it is lined with soft material and padding on the inside for extra protection. I ordered the Blue case and it looks just like the picture but it smelled a little funny upon opening, but nothing to cry over. The smell became completely unnoticeable after a few minutes. I only give this bag 4 stars at the moment because I just received it so I cannot give an honest review of the longevity of the case, but so far I LOVE IT!!"
4.0,Sounds great..
4.0,Very nice color and quick shipping
4.0,Had the original kindle which tragically was dropped and screen cracked....Love the new kindle.
4.0,"I am enjoying this beach scene...it reminds me of home. However, the product would be event better if the light would shine through the stickers so one would be able to see the keys easier."
4.0,good product
4.0,"This sticker fits just over the whole apple on my 15&#34; macbook pro. While you have to be extreamly accurate to get it perfect, thhe end result is epic! Much better than most stickers. However..Im OCD so I pressed down very hard so there are no bubbles but if you look very close you can see how I pressed hard and the apple underneath - its outline is a tad visible..but from the normal looks your gonna get its epic!"
4.0,Great monitor!
4.0,"It fits perfectly and is much easier to use the tablet,"
4.0,Easy and quick set up. Decent quality for the low price.
4.0,"Perhaps I didn't know what I was getting into with a QODE keyboard, but it is difficult to switch back and forth with a QWERTY keyboard on a computer.  Overall, I have been satisfied, but I do feel like the case (at least at the binding) is pretty flimsy.  I am not sure it is going to last me more than 6-9, maybe 12 months, being constantly on the go.  Having to manually turn the keyboard on and off gets a little annoying when trying to use it in tablet mode.  A good product, but not a great one."
4.0,For a cheap mouse this works great.
4.0,I purchased this headset for my Livescribe Echo pen and love them. I'm using my livescribe pen and headset in an auditorium like classroom and they work great. Highly recommended!
4.0,"Outstanding value for money.  I wanted an Android tablet primarily as a means of browsing the Internet and watching streaming video, and in these respects, the M8 tablet does exactly what I want it to do.<br /><br />Pros:<br />- Clear, bright high-resolution screen.<br />- Expandable storage (microSD), bluetooth (for external speakers), mini-HDMI.<br />- Lightweight with fairly good battery life.<br />- Smooth video playback.<br />- Good Internet browsing experience.<br />- Good build quality.<br /><br />Cons:<br />- I hope Dragon Touch updates the M8 to Android 5 Lollipop, if the hardware can handle it.<br />- Android 4.4.2 runs smoothly, though some apps seem slightly laggy."
4.0,"Really good value, and works as advertised!"
4.0,"Plugged this dongle into my MacBook Pro and then the HDMI cord from the TV and it worked instantly.  However, I originally purchased this to be able to watch 4K videos on my TV.  This is not possible.  The computer n TV can both support the files, but the cable does not transmit at 4K.  I can't remember exactly, but it maxes out at 720 or 1080."
4.0,Works fine.
4.0,"I ordered this to speed up reprogramming BIOS on some flash parts.  I was using a Bus Pirate and it was taking about 25 minutes to reprogram each part.  With this each part programs in 2 minutes which is much better. The reason this only gets 3 stars is because the drivers included with it for 64bit windows aren't signed, this means you have to jump through a lot of hoops if you want to use this on a 64 bit machine.  I cheated since i have access to a real signing certificate through my work.  I had to modify the .inf file but eventually I was able to sign the drivers and get it working on my 64 bit Win 8.1 machine.  Update: Global Cyber Mart responded quickly to my request for signed 64 bit drivers and pointed out that the item says 32 bit.  So I've increased the rating from 3 to 4 stars.  I've suggested they add a bullet item stating specifically that it is NOT supported for win 7/8/8.1 64 bit because I think the way they indicated 32 bit only support wasn't very obvious.  Pros: - Fast.  8MB part in 2 minutes - Cheap - Included software is easy to use.  Cons: - No signed 64 bit driver.  Beware Windows 64 bit users!"
4.0,It works as advertising.
4.0,Snapped into place easily and seems secure.  Haven't had it very long yet so I cannot comment on durability.
4.0,Great fan. Does a great job cooling my xbox360
4.0,Very happy with the speed web pages load. Screen quality good. Track pad requires a harder tough than others I've used.
4.0,"Worked as advertised. Connection is fast, even on a power strip. The included software is not Win10 compatible and it's required to reset the adapters to factory default. Download the latest version from the website, which works on Win10."
4.0,Great product!
4.0,"Bag of good quality, though a bit more than I expected"
4.0,Kind of a short battery life. Probably from the ads displayed on the screen.
4.0,"Is really cute,  it looks really big in the picture but is actually perfect size not to small but perfect to carry a book, water bottle and other things."
4.0,it extends the 1s and 0s just fine
4.0,Very nice equipment
4.0,"This paired well with my WD black hard drive. Plug and play, pretty much as easy as it gets. The unit does get a quite warm after extended use though"
4.0,Sounds pretty good.
4.0,Works...after almost a year I started to lose internet even with full signal from extender.  It turns out that there are more wifi signals in the neighborhood which caused interference.  A friend suggested changing the channel on the router.  Now I have no problems.  Most people use the default channel 1 and everyone was interfering each other.
4.0,"It Stand straight upright, keeps falling forward, should have been slightly slanted. Easy to carry."
4.0,The hole for headphones could be a little bigger but no other complaints.
4.0,Very quiet.<br />Moves the air nicely.
4.0,Very good
4.0,"The keyboard came and is missing the &#34;bluetooth connect&#34; button needed to pair it to my computer. I put batteries in it and the power light comes on, but my computer can never locate the keyboard.  *****edit****  The company contacted me and helped me get the keyboard working (thank you).   It's a good little keyboard for the price. About the size as an apple bluetooth keyboard, but a little cheaper feeling. No complaints though for the cost."
4.0,"I bought this for an old iPad2, which it fits perfectly. Here's what I like / dislike about the case...<br />PRO'S<br /> - As I said, its a good fit<br /> - It offers 2 separate incline positions<br /> - The magnet in the front cover wake the iPad without issue every time<br /> - I appreciate the look... clean, tidy, not too bulky<br />CON'S<br /> - It doesn't offer as much protection as I was hoping, especially for the corners and/or edges. If your kids will be using your iPad, this may not be the case for you.<br /> - To incline the iPad, the front cover of the case folds back and tucks into a little holder on the back cover. It tends to slide out of the holder at times.<br /> - The volume buttons are a little awkward to access when in the incline position.<br /><br />In summary, this is a decent product, with just a couple of small design flaws. Still it is well worth the small price tag, and at under $15, I would recommend to others."
4.0,"Love my keyboard protector. Took getting used to as silicone feels a little bit sticky compared to the name keyboard. But I like the protection is gives as I tend to be a bit messy and eat around my computer. My only gripe is that the keys on the top left slightly don't align to my Apple 13&#34; retina, so at night, it has a double outline, competing with the bottom light, but you can turn off the keyboard light and it should be fine."
4.0,First set had a bad stick of ram.  The return was easy and the second set works perfectly.  Can't beat it for the price!
4.0,Works well so far only had for 1 month.
4.0,works fine
4.0,great deal
4.0,So far so good. I've always liked WD drives.
4.0,"I have a macbook pro 15&#34; retina and it fits perfectly in here, even with a little room to spare, so if you have a case on your laptop, it will fit in there. the inside is a nice velvety fleece. I wish the pocket on the outside were a little bigger so I could fit my charger extension cord in along with my charger, but its still a good case."
4.0,Good optical drive. Didn't realized until after that it was Blu-Ray READ ONLY. My fault.
4.0,I've been purchasing Transcend storage solution products for some time now.  On a previous occasion one of their products failed.  Transcend replaced it with no hassles.  Transcend offers a good selection of products and provides good value for the money spent.
4.0,"For under $30, these are good headphones.  They are light and comfortable.  The velvet ear-cups are cooler then leatherette cushions in my opinion.<br /><br />Sound is okay, music is a bit muffled but games sound great on them.  The microphone works very well and I have had many say they hear me clearly.<br /><br />One other feature I like is the ear-cups swivel to conform to your ears.<br /><br />They are not the greatest, but as a back up pair to my broken Hyper Clouds, they work just fine."
4.0,great
4.0,good
4.0,"Nice looking, fits well and economical"
4.0,Wonderful for kids.
4.0,"Once I finally got the Range Extender properly configured and located in the right spot, it is providing exactly the performance for which I was looking.<br /><br />As other reviewers have noted, the installation may not be as turnkey as most users would like. I am retired but am still fairly technical. I have a computer science degree, worked as a systems engineer for a computer company, worked in R&D for a computer company, and managed systems and software development for two companies. I usually have no difficulty getting a new device installed and properly configured.<br /><br />It simply would not work for me with the supplied installation CD. I went on the Linksys web site and downloaded the latest firmware (build 6) but going to 192.168.1.1 didn't take me to the Range Extender set up; it took me to my wireless router set up. I went into the Control Panel into the Network and Sharing Center and clicked on See Full Map. The map itself does not show the Range Extender but below the map is listed the devices discovered that could not be placed on the map. There I found the RE4000W. By right-clicking on that icon, you get the option to View Device Webpage. Clicking on that, I was indeed brought to the set up screen for the Range Extender. For me, its ip address was 192.168.1.247. This allowed me to log in (username blank, password admin), install the latest firmware and change the device's password to something other than the default admin for security purposes.<br /><br />I then downloaded the latest product installation program from the Linksys web site and ran it to install/configure the Range Extender. Note that it did not connect the first time, but the installation screen lists a number of possible reasons. One of the reasons is that you don't want your installation device (a laptop in my case) too close to the Range Extender itself. I was about five feet away. When I moved into another room, I was able to get a successful installation.<br /><br />Now the challenge was where to located the Range Extender &#34;permanently&#34; in the home. My wireless router is located in our basement, and I purchased this Range Extender to help my laptop connectivity from my home office on the main level of the house. Prior to the Range Extender installation, if I used my laptop in the kitchen which is directly above the wireless router location in the basement, I got a five bar connection and speedtest.net showed a 24 mbps download speed (I pay for a 20 mbps connection). If I moved my laptop to my home office, I got a two bar connection and speedtest.net showed that my download speed dropped to 1.8 mbps. My hope was that the Range Extender would allow me to get 24 mbps download speed in the home office.<br /><br />My first thought was to place the Range Extender in the kitchen directly above the wireless router location. That gave the Range Extender a five bar connection at both 2.4 Ghz and 5.0 Ghz. However, the laptop in my office only showed a three bar connection the the Range Extender and the download speed was only 2.6 mbps. (Note that in this location the signal needed to go through six walls.) I then moved the Range Extender to the office and observed the reverse of the problem - a good connection from my laptop to the Range Extender and a poor connection from the Range Extender to the wireless router (no connectivity at 5.0 Ghz and two bars at 2.4 Ghz).<br /><br />I then changed the Range Extender location to be on a wall in the kitchen between the original location and the home office. It gave me connectivity at both 2.4 Ghz and 5.0 Ghz but the speed was almost the same: 2.8 mbps. (Note that in this location the signal needed to go through four walls.) My &#34;last&#34; spot to try was putting the Range Extender in the wall outlet on our kitchen island. This location has a direct line of sight from the laptop to the Range Extender and is just 30 feet away. Voila!!! The connection from the Range Extender to the wireless routerhas five bars at 2.4 Ghz and four bars at 5.0 Ghz, and the connection from the Range Extender to the laptop has a five bar connection and a download speed of 25 mbps - exactly what I had expected.<br /><br />I rate this Very Good, because it is able to achieve the performance objective for my situation. However, I can well imagine that other home configurations may not be so forgiving. If I take my laptop to our master bedroom on the second floor of the house, my download speed drops to 20 mbps. If take it to the second floor bedroom on the opposite side of the house, the download speed drops to 2.0 mbps. Clearly, its range is significantly affected by the number of walls through which the signal must pass as well as what is in those walls.has five bars at 2.4 Ghz and four bars at 5.0 Ghz, and the connection from the Range Extender to the laptop has a five bar connection and a download speed of 25 mbps - exactly what I had expected.<br /><br />I rate this Very Good, because it is able to achieve the performance objective for my situation. However, I can well imagine that other home configurations may not be so forgiving. If I take my laptop to our master bedroom on the second floor of the house, my download speed drops to 20 mbps. If take it to the second floor bedroom on the opposite side of the house, the download speed drops to 2.0 mbps. Clearly, its range is significantly affected by the number of walls through which the signal must pass as well as what is in those walls."
4.0,HAD TO ORSWE THREE COVERS UNTIL I FOUND ONE THAT FIT
4.0,Snapped into place easily and seems secure.  Haven't had it very long yet so I cannot comment on durability.
4.0,"Great overall, just doesn't go on perfectly, no matter how hard you try, there's always something wrong (bubble, crease, etc.)"
4.0,for the money i like it .
4.0,"This case is very sturdy BUT it's difficult to put on and once it's on, the buttons are extremely hard to push. My 3 and 5 year olds have to bring us their tablet every time they want to adjust the volume. We own 2 of these and I do feel like our tablets are very well protected, it's just the minor annoyance with the buttons that gets a little frustrating. I do recommend this product to other buyers."
4.0,"It is small - not much bigger than my iPhone 6. I wasn't sure if I would like the smaller screen. ( I thought I had ordered the 7&#34; model.) It turns out I love the compact size. It fits into a small purse and traveled well. The case I ordered is working out well. I have had this Kindle for only two weeks. One draw back is that it does not seem to hold a charge as well as my Kindle Fire did, but so far it has not been a problem."
4.0,"Great tablet for the average use. Nothing too special, its just right for the price. One major Con though is the screen angle, if you are not looking directly at the screen you'll just see a blur."
4.0,"I wish it &#34;connected&#34; with my iPad a bit better (I don't know the word for it, but it seems to not work nearly as well as my finger), but overall ok."
4.0,"Looks good, seems to work well--fast transfer of data--although I've already encountered one type of USB device (micro disk adapter) that it refuses to recognize. I have to that USB directly into the computer to access the disk. I'm hoping this is not a progressive problem and that over time I discover more devices that won't function on it. Fingers crossed."
4.0,"I have an older Kindle fire & recieved the Paperwhite as a gift. The paper white is a perfect size and handy for reading books you already purchased. Shopping for titles is a little more difficult because the covers dont render very well in black and white.<br />Pages are easy to read,  the blacklight adjustment is easy to use for any lighting situation.<br />If the Paperwhite is going to be your only e-reader keep in mind that shopping is easier thru a tablet, laptop or desktop."
4.0,"Battery came charged, fit and worked great! I'm satisfied. Thank you!"
