overall,reviewText
4.0,I am not sure I don't know if it is the tablet or lollipop.  Sometimes I can't get a good connection.  Otherwise I do like it.  It does almost everything I want.  els well made.  I have one of there computers and I thought this was a good buy and was thinking that there computer was good.
4.0,Love that Finite makes different designs and that the grooves are pretty deep to hold the IPad Air up. That's why I bought the case. But...the auto awake and shut off does not work with my case and not sure why. So I have to set auto-lock in the iPad settings just so it shuts off with inactivity.
4.0,This is pretty much what I wanted. A backpack that was slimmer than the Ful backpack I previously used. I miss the multiple zippered compartments though. I wish there were more quick access front pockets although the lumbar pocket is pretty handy so far.
4.0,"Great laptop. got it for the wife for her birthday. No issues thus far. However, we paid only $323.00 for this at the Microsoft store in June. That's $200 less than the price here. $520 is way out of line for this laptop."
4.0,It works for its price. Can't complain.
4.0,"This was bought for my 5yr old. His class uses an online program for schoolwork. It is very thin and lightweight. We keep it a leather folio cover. It is very easy for him to use, Except, he doesn't always remember to hold the power button down to turn it on. We bought one in black and one in blue. They're both a great affordable option."
4.0,Perfect compatibility.
4.0,It took a week to get it delivered but it kit was new and worked great.
4.0,"I still recall the day I upgraded my 20GB Xbox 360 HD with a 100GB HD and thinking, &#34;There, now I'll never have to worry about storage again.&#34; Fast forward 4 years, lots of Rock Band DLC and the ability to store full games to the HD and I find myself at about 90% full. Enter the Seagate 2TB drive. Now I can have that feeling again of, &#34;There, now I'll never have to worry about storage again.&#34;<br /><br />This Seagate game drive seems to be a pretty typical 2TB hard drive, priced similar to other 2TB drives, but with officially licensed Xbox One or Xbox 360 compatibility and design. When you consider the basic Xbox One 500GB console is currently priced around $350 and the newer 1 TB model is about $400, you could get the 500GB model and one of these drives (currently $100) and spend about $450 and have a total of 2.5 TB of storage. Basically, an extra 1.5 TB for an extra $50, which isn't a bad deal. Of course, you have to consider your current usage and potential future storage needs.<br /><br />The main thing I think it lacks is a little more in the way of instructions for transferring data from the console to the drive. While it wasn't that difficult for me to figure out, it might be a little more challenging for a parent who is not as up to speed on how these work. Especially considering it is an officially licensed Xbox product, it was surprising there was little more than a short pamphlet describing the drive's features included. I wish it would have gone into more detail about how it handles in-game DLC licensing content vs game content. It was not the most user friendly in that regard. I finished transferring data and wasn't positive if I was going to be able to play with DLC once it was moved to the drive (I was). A little more clarity in what it would and would not transfer would have been helpful as well as explanation on what you need to do if you use it on an Xbox 360, then upgrade to the Xbox One. I plan to do this in a few weeks, so I mayupdate the review if I hit any other snags in that process."
4.0,I use this keyboard as a keyboard for my test bench (Where I work on computers to repair them) and it works great! They keys are a bit mushy and close to the edge but overall for the price this keyboard is great. The plastic is high quality and so are the key caps and connector. Would buy again if I ever needed anything like it.
4.0,good product
4.0,nice pfoduct
4.0,"I had to return this (for a reason I can't recall, sorry, but I think it wasn't due to any problems with the keyboard itself).  I'm pretty sure it worked fine, although I don't like the way they position the Enter key.  Apparently I'm used to Dell keyboards because I've used them for decades and now i'm used to the Enter key being horizontally long and the \ key being above it.  But it seems like most keyboards that I see these days have them switched, so when I use them I keep hitting / instead of Enter and it's infuriating.<br /><br />Sooner or later I'll have to adjust since it appears to be the standard for newer keyboards.  Gotta start reaching farther out for that Enter key!"
4.0,Cords don't last very long. Disappointment
4.0,"Works as advertised, but don't get this type of device if you're hoping to capture signatures."
4.0,good
4.0,"such small, much storage, wow"
4.0,"Bought this to extend the life of an old laptop with a dead internal fan.  Without the Opolar fan, CPU temps were cresting 170Â°F.  With the Opolar even running at lowest manual speed, temps rarely go above 120Â°. With the speed tuned up a few clicks, it's rarely above 110Â°.  I'm really impressed with the effectiveness.<br />The &#34;auto&#34; fan speed function seems like a great idea, but unfortunately it requires a working laptop fan for it to operate.  This seems odd since I imagine that most people buy this (like I did) to replace the cooling function of a dead fan, not as a fan booster.  The auto fan speed control senses the temperature of the air being directed out of the laptop -- perhaps a future version could incorporate a temperature sensor cable that could be placed inside the laptop vent to directly sense the internal temps and control the auto fan speed that way.<br />Pros:  Simple connect and attach. Works really well at keeping laptop CPU temperatures under control. Reasonably quiet even at high speed.<br />Cons: The arms that clamp the device to the side of the laptop could be longer.  They're short enough that the weight of the Opolar itself can sometimes work them loose.  And the previously mentioned auto-speed function not working without a working internal fan.<br /><br />Anyway, this is a well crafted product and I'd recommend it."
4.0,It lasted me a long time and it works just fine.<br />My only issue was that it stopped working after a few months and there were no signs of damage. But it did what it had to do and works fine.
4.0,Just what i liked
4.0,I like case
4.0,"These work well and are incredibly useful, be it for plugging in external storage, a keyboard and/or mouse, or even a USB gamepad. The two-pack is handy, too, but the wires on the micro USB end became exposed on mine because of the angle the connector is at; a little wire glue will fix it up, though."
4.0,This mouse is great little mouse. i like the shape and the buttons. The scroll wheel works well and the dpi switch works fine. I am a male and have a large size glove hand (I don't wear them when mousing) and this mouse is unfortunately too small for me to use comfortably. I kept searching for a good position and was either too far forward or too far back. About 15% to 20% bigger and it would be perfect for me. For anyone with a medium or smaller hand I am sure it would be great.
4.0,I bought this case for its unique shape and color. Fit a full board and 5 fans installed . Feels kinda cheap but sturdy enough for a build . My two complains are the front usb issues I had. First the 3.0 has a usb male connection that if I didn't buy the usb to pin converter to install on my board it would take a usb slot on the back of your Mobo and you'll have a cable sticking out also. 2nd for the love of everything the usb 2.0 would not work on the pin above the power reset had to use an alternative .. I have a problem with cable management I hate seeing cables so I'm proud that you can barely see any.. Recommend if you go the route I went with to fix my minor complaints .
4.0,Thank you
4.0,Thank you
4.0,"Love it. Obviously there are a few things that could be better, but they probably have them in the more inclusive models."
4.0,"Forward slash key takes a few repeated keystrokes to work.  Other than that, great keyboard.  I love using the lighting of it at night.  Thanks!"
4.0,Very good
4.0,"love the neat size and legibility. i do wish it had colour though. bought it thinking it would be good for graphic novels, books with art illustrations etc.  So less than six months later I've got a damaged screen, probably my own fault because i placed it in my bag without pulling the cover down. Something probably pressed against the screen and now i've got a blank area in the top left corner which basically makes it unreadable. Sigh. I need a new screen now."
4.0,"I was surprised at how light this product is. Once the cables are plugged into the back, it has trouble staying upright. It would be nice if Trendnet provided a snap-on base of some kind. Since I'm only using it as a wired router in my network, I turned off the wireless radio and so I can't comment on that. For my wireless I am using a hi-end Asus as an access point at the other end of my house. Trendnet's user interface is mostly fine, much better than the one on my previous router. I assume that the firewall is always on, since there's no option to turn it on or off. Overall this is an affordable router giving you gigabit wired speeds, the newer IPv6 protocol, and dual-band wireless, though I can't say how well that works."
4.0,Works fine
4.0,OK it works like it is supposed to.
4.0,Not easy to use 3rd party backup software with.
4.0,"I would give it 5 stars if I could stop the colors from changing. I don't know why they thought people would watn their mouse constantly changing colors. Otherwise, works great for the price."
4.0,"After my laptop keyboard went caput, this was a lifesaver!"
4.0,This case provides bare minimum protection to my Kindle but allows it to be inserted in stand purchased elsewhere.
4.0,Cool backpack for the school!
4.0,"Worked perfectly with all my official MSPDs, not so well with my knockoff Chinese ones. This is annoying because every OTHER device I have works fine with those memsticks. I can't fault this device for not working with them, though. With an official MSPD in it, operation is FAST and flawless. The clear cap doesn't really stay on the end after you've used it for a while, though."
4.0,It works well and does not talk back.
4.0,"I bought these for my daughters for road trips and downtime.  I got them during the sale, so I figured for $70 it's hard to go wrong.  The devices are sturdy, work well and you can get most apps in the Amazon Store.  The kicker is, you really need a separate Amazon account for each person to operate it correctly.  I set up some temporary emails and then accounts for each of them, with no method of payment.  I can still monitor all the activity since I have access to those accounts.  The kid profile under your own account just doesn't work."
4.0,"A nice solid laptop. For the price you can't expect much, the pre-order price made a it a no brainer, you would be hard pressed to find another laptop sub $400 with a full 1080p display. Battery life seems to be about 3 hours from my experience, that's a combo of installing application, web browsing and writing code.  If you don't have any intention of gaming, you will find this to be a wonderful laptop. The integrated Intel, while they are progressing, can't hold a candle to a real dedicated GPU. Battery life isn't as great as I was hoping, but not bad. It can still be mobile, but not the 5-6 hours I've had in a nice quad core i7 mac book pro from way back in 2011. The hard drive does seem fast enough for normal use. Keyboard is okay, not great but seems to work for what I need.  Pros 1080p &#60;-- this is what pushes it to the top of the budget laptops in my book. (developer) Pretty thin and lite. Enough processing power. Enough memory.  Cons, not really cons just really considerations. It's a mobile i3, not for heavy processing. 4gb of memory, I routinely see 60-70% usage 5,400rpm drive, not a deal breaker but in the world of SSD's, its pretty slow. Trackpad feels pretty cheap.  There is some extra junk installed, but it wasn't hard to remove. I have since ordered another 4gb stick of memory and a SSD but have not installed it yet. From what I've found out the upgrade process is a lot more work than it should be. Also I have not been able to find any real specs or manual online or in the box for this specific model to tell you things like, the max memory supported etc.  This is all subjective to my experience, your mileage will vary.  After having read my review, it's pretty indecisive. I want to say that for normal day to day use, it will serve you well. Just no gaming or heavy processing."
4.0,"handy little flash drive, but the hinge doesnt seem like it will last forever... to be clear it hasnt broken on me, but I wouldve liked the hinge to be more substancial"
4.0,"Looks nice, but when I plug in my iPhone 5s indicates this charger cable is not Apple certified. Additionally, my charging block heats up beyond normal."
4.0,"I really like these speaker, the fact they were USB threw me, as I am no tech junkie, and they are not the loudest even at full volume but this hard of hearing old man can hear them quite well and they put out good sound."
4.0,"A good quality memory for smartphones and tablets,  comes with adapter for pc too"
4.0,"Awesome little addition to my desktop.  Was very easily plug and play and it reads everything I've put into it so far (CAC card and SD card).  Only complaint is the speed at which it transfers information from PC to SD card (could be the card, will have to see) and that the screws for the mounting bracket for those of us who don't have a 3.5 bay are too far forward, preventing this guy from sitting flush in my case.  Other than that, no complaints.  Great product."
4.0,For the price gets the job done. Ended up tossing the keyboard cover- it smudges my screen.
4.0,Well worth the price.
4.0,"2 years' use from mine so far, with no issues. Runs whatever I plug into it, never makes anything give me a 'low power from port' warning. Never causes any problems when hot-swapping stuff. It's on par with the Belkin hubs from back in the day. Best powered hub for the value, IMO."
4.0,The kid loved it!!
4.0,Feels a little cheap but that's probably because it has lots of vents for air flow. It's very quiet and it isn't too bad to have on your lap.
4.0,"I was surprised by this monitor. I was really not expecting something so good. It is sturdy, the resolution is amazing and it seems to work just great."
4.0,This is my 2nd one.  Works as advertised with no issues whatsoever.
4.0,"Short simple and sweet, this is an enjoyable device to use. This runs windows 10 beautifully. If you do run windows 10, make sure you download the drivers of of Asus website for the T100TAM.<br /><br />Supports stylus but will lag with drawing applications that Ive tested. Battery life is really really really good.<br /><br />The only downside is that it smudges easily, and browsing PDF files in portrait mode doesnt scale to screen. (using adobe reader )<br />Overall, great device, and a lot of bang for the price."
4.0,IN THE TOOL BOX
4.0,good
4.0,great buy. This is my second Kindle Fire. I gave the 1st one to my daughter and now we share books
4.0,good
4.0,"Rally like it, it got here in a week charges great and is very cheap and made from good material."
4.0,Don't recommend plug in external hard drive to this device.
4.0,Very good quality case. Withstood multiple drops and no cracks at all.
4.0,all ok
4.0,"I updated my old computer because I was unable to play some of the newer games on the market. This was reasonably priced and gets the job done. It's not the newest and the best, but it does what I want. And you can't beat the price."
4.0,Definitely helps with wrist problems.
4.0,"The size of the mouse pad is great, as it lets my hand move around quite a bit without the mouse losing contact with the pad.<br /><br />My only complaint is that after several months of use, the fabric on the top of the mousepad (where my wrist sits) slowly starts to degrade. Because the mousepad is black, the fading is very obvious. I haven't been able to find a fix for it yet.<br /><br />That being said, I will probably purchase another one of these."
4.0,"The plug is great, the wire is a little wimpy, but it works well."
4.0,"Lightweight, easy to hold, & easy to put kindle in & take out"
4.0,"Works just fine, did the job as advertised at a good priced."
4.0,It does charge my tablet but it fits into the tablet loosely.
4.0,Good performance and quality.
4.0,Bought this as last ditch effort to save my hard disk data from non working laptop Dell N5010. It worked really well with my hard disk. Was able to read all the data. Worked like a charm.<br /><br />Thanks!
4.0,It's taking me a while to get use to the key pad ( it's a bit small) color is clear easy to hold also.
4.0,"The cable appeared to be well made with quality materials. The connectors securely attached to the hard drive and the motherboard. My desktop's chassis has very tight quarters for the hard drives, so the 90-degree connector worked great for that tight space."
4.0,Price was good product was as promised.
4.0,Inexpensive and very competent<br />I would buy again
4.0,Exactly as described.
4.0,Works better than expected
4.0,"I love the long cable, but it is a little loose when connected."
4.0,"It took me 4 minutes to get Authorixation web page, and then a couple more to have Comcast finalize.it. I did not need all the serial, model #'s. Just entered my account and wala.<br />FYI I am getting approx. 4% faster speed...for free!"
4.0,"Not much to say really as it arrived on time and it works.  I actually used it to replace the battery in a tire pressure sensor on my motorcycle so had to remove the yellow protective covering, which is quite thick btw, and cut the plug off to solder to the TPS circuit board but it works fine."
4.0,This seemed to work very well for us.
4.0,I can't remember so this does it for me
4.0,good batteries
4.0,Good product but color isnt as shown. I picked the blue and it looks like a robins egg blue or a sky blue and when it came its a very dull light medium blue. Definitely would have chosen another color if I would have lnown but other than that is a good case.
4.0,"Cable gets the job done at a cheap price, it does feel very cheap as well, but it works so who cares."
4.0,"The decal sticker that your going to get is ok, when this is all you can afford. The nice thing is if you don't line it up right you can re-apply it over and over and it will still stick."
4.0,This would have 5 stars but it's little to no padding on the bottom.  The inside is very soft and plush on the sides with lots of padding.  The bottom however is just the fabric. I feel they messed up with that.  I am going to try and find a piece of foam to glue along the bottom.  I have an hp specter x360 and it's a 13in laptop so lots of room.  I also have the Amazon basics sleeve.  I put the laptop into the sleeve and the sleeve into this bag and things fit great.
4.0,"Pro's---this product is an exact fit,for my ipad air.<br />I'm verrry happy..also..lov the functionality of it..it does n looks just like the pic,on amazon..quick shippn tooo..<br />Cons--- in the pic..it looks like where it closes.. and has a velcro latch..not soo.. it's just a canvas loop that you can barely put your finger in.. I'm not too sure, what it's for!<br />And it's very slippery.. it has slid off my chair.. quite a few times.."
4.0,"I was worried that the Rockchip processor would hinder this machine, but I was wrong.  The battery life is amazing, and this machine is fast!<br /><br />I wish it had a 1080p screen, but for 11 inches and only 169, I cant ask for much.  Great machine!"
4.0,nice for lots of photos
4.0,"This was bought for our 7yr old. His class uses an online program for schoolwork. This is his second tablet as he destroyed his first one last year. So far it's held up really well. It's kept in a leather folio case. He did already break the charger by bending it. It's easy for him to use & processes quickly. It's not as overloaded with junk as some tablets. It is thin & very lightweight. Overall, a great affordable option."
4.0,No problems so far.
4.0,Good sized mouse. Love the fact that you can select a single color. Only gripe with it is that you have to keep selecting the color every time you restart your computer. It will for whatever reason reset back to multi color once pc is turned off.
4.0,Fantastic range.  Works great to feed my phone into my home stereo.  The only thing I wish this product had was an on/off switch.
4.0,"Good, but the unnecessary holes on the bottom make it easy for dust to get underneath the case, but more importantly, the holes grab the hairs on your thighs if your the type of guy that likes to work in your boxer briefs and sets your laptop on your lap.  I've gone as far as to shave the front of my thighs to prevent the plucking of my hairs, which does work, but granted that I am a rather body hairless man, I can imagine the more furry the man, , if you will, the more odd this shave pattern may appear.<br /><br />BTW, the two little legs on the back are surprisingly sturdy, when I do decide to work fully clothed at a desk.  I do enjoy typing at an angle."
4.0,smooth operation and handles detail work for Photoshop very well.
4.0,nice picture no problems.
4.0,"Good quality.  Has a design flaw.  The front support pegs push up into the case, cause the case to fall over (forward)."
4.0,This case fits really tight. The magnetic strip allows two different angles for watching movies or working. It's really slim and protects the entire face.
4.0,Does its job.<br />Kinda tight until broken in but it is good.
4.0,The charge doesn't last quite as long as advertised but the light works well & clips onto my book making reading in bed enjoyable without disturbing my spouse asleep next to me.
4.0,Product worked fine.  The directions do not explain well enough on how to open the box.  To open:  put BOTH thumbs on right side of box and slide forward with pressure ONLY on the right side.  (the right side when &#34;window&#34; is toward you).
4.0,It's good. Great size. I love it for the most part. Don't like that it can't play audio books. Don't like the adds but that's  ok if you get the Amazon kindle case and disable the lock screen by  typing ~ds in the search bar.
4.0,"durable leather handle, the plastic stand underneath the leather handle is a little fragile that broke quickly."
4.0,Great for cheap USB 3.0 drive with decent read speed of ~124MB/s but the writes speeds are slow at ~24MB/s.
4.0,Nice in terms of size and sound. Idel for the beach.
4.0,"Works like it should. Used it to make a recovery disk for my PC, no problems at all."
4.0,As described
4.0,Feels great! The only warning I have is when zipped keep the zippers to the top and be mindful how you open the case. Your computer can accidentally fall. If you are cautious this case is great!
4.0,Ok
4.0,"Even though the point resolution is not that great, everything else works fine."
4.0,Pretty decent. It's good at cancelling outside noises. The sound sounds nice and sound hehe.
4.0,Work with my MBP15&#34; 2009-2011.
4.0,"I really like this keyboard.  Colors are great and the gentle tapping of the keys is appreciated.  Nothing worse than listening to  bunch of tick,ticking all day.  I do however wish the colors were brighter.  They look great in the dark, but who works in the dark???"
4.0,"Not the greatest nude, a bit pinker than I thought, but accurately described. I love the Kate line of Rimmel. They are rich in color."
4.0,"This wireless keyboard is a great thing for home theater PCs. However, the signal strength on my keyboard was pretty pathetic. You need good line of sight from the receiver, and it won't work reliably beyond a few feet. But the price is right for the purpose, and I use it every day!<br /><br />As for the trackpad, it seems fine. As good as many laptops I've used. The buttons aren't very tactile and feel kind of rubbery to press, but you get used to it.<br /><br />The keyboard is not something you should use at your desk for typing papers and reports. Get yourself a real keyboard for some real work. This is a consumption device, not a production one."
4.0,Wel made.
4.0,"Like other AmazonBasics items I have purched, this cable is solidly built, does its job, and is affordable."
4.0,"I love my new headphones! The only thing I wish was that there was a microphone.  Or if there is one,  I haven't figured it out yet.  :) Shipped in good time too."
4.0,Display is large and clear.  Easy to operate.  A bargain.
4.0,So far this works as advertised. No complaints.
4.0,Works fine overall. Sometimes I have issues getting the games out.
4.0,Works great with Plex. Using Ready Cloud app to access your movies in your readynas needs updating. Please have desktop readycloud app for Mac osx available.
4.0,Functioning power supply ~ We bought this for our small computer case.
4.0,"Haven't had much time with it yet, but it gets the job done."
4.0,"First one died after 10 minutes of use.  RMA was easy, and the second one works great and is fast.  This is the first time I have had a problem with samsung memory, so this is the first 4 star review I am giving them."
4.0,"Nothing special, but it works"
4.0,Just finished pulling 4000 ft of this cable through new construction and didn't have any issues.  I would recommend that as you get closer to the end of the spool you will want to unroll the length of cable you need and stretch it out.  This will help keep the cable from kinking.  This is common sense with almost any ethernet vendor.  I would purchase this again.
